id,title,uniform_title,alternative_title,creator,contributor,publication_place,publisher,publication_date,encoded_date,creation_date,copyright_date,edition,issuance,language,type_of_resource,format,extent,genre,abstract,subject,temporal_coverage,geographic_coverage,target_audience,record_id,isbn,lccn,oclccn,url,depositor,collection_id
00z423660m,Lessons in hygiene: an elementary text-book on the maintenance of health : with the rudiments of anatomy and physiology and the treatment of emergent cases : comprising also lessons on the action of stimulants and sedatives on the brain and nervous system : adapted for common schools,,,"Cutter, John C. (John Clarence), 1851-1909",,Philadelphia,J.B. Lippincott Company,,1885,1885|||1885-01-01T00:00:00,,,monographic,English,text,print,180 p. : ill. ; 20 cm.,,,Hygiene|||Juvenile literature|||Physiology,,,,423660,,07033419,,,University of Pittsburgh,collection.120
00z426609m,"Dainty songs for little lads and lasses: for use in the kindergarten, school and home",,,"Murray, James R. (James Ramsey), 1841-1905",,Cincinnati,John Church Co.,,1887,c1887|||1887|||1887-01-01T00:00:00,,,monographic,English,notated music,print,1 score (160 p.) ; 16 cm.,,,Children's songs,,,juvenile,426609,,,,,University of Pittsburgh,collection.120
00z426876m,School melodies: containing a choice collection of popular airs with original and appropriate words composed expressly for the use of schools,,,"Greene, J. W. (James Whitman)",,Boston,Morris Cotton,,1852,c1852|||1852|||1852-01-01T00:00:00,,,monographic,English,notated music,print,72 p. of music ; 11 x 17 cm.,,,School songbooks,,,,426876,,,,,University of Pittsburgh,collection.120
00z444840m,"first reader, The",,,"Monroe, Lewis B. (Lewis Baxter), 1825?-1879",,Philadelphia,Cowperthwait & Co.,,1873,c1873|||1873|||1873-01-01T00:00:00,,,monographic,English,text,print,96 p. : ill. ; 19 cm.,,,Readers (Elementary),1870-1950,,,444840,,55054644,,,University of Pittsburgh,collection.120
00z469484m,"Analysis of civil government: including a topical and tabular arrangement of the Constitution of the United States : designed as a class-book for the use of grammar, high, and normal schools, academies, and other institutions of learning",,,"Townsend, Calvin, d. 1881",,New York|||Philadelphia|||Chicago,"Ivison, Phinney, Blakeman, & Co.|||J.B. Lipppincott & Co.|||S.C.Griggs & Co.",,1869/1868,"1869|||1868|||1869, c1868|||ca. 1869-1868|||1869-01-01T00:00:00",,,monographic,English,text,print,342 p. ; 20 cm.,handbook,,"Politics and government|||Handbooks, manuals, etc|||United States.",,United States,,469484,,09025699,,,University of Pittsburgh,collection.120
00z470549m,"principles of the government of the United States: adapted to the use of schools, The",,,"Davis, Pardon.",,Philadelphia,H.C. Carey and I. Lea,,1823/1822,"1823|||1822|||1823, c1822|||ca. 1823-1822|||1823-01-01T00:00:00",,,monographic,English,text,print,240 p. ; 18 cm.,,,Constitutions|||States|||United States.,,United States,,470549,,09021786,,,University of Pittsburgh,collection.120
00z480908m,"Fashionable American letter writer, or, The art of polite correspondence: containing a variety of plain and elegant letters on business, love, courtship, marriage, relationship, friendship, &c : with forms of complimentary cards : to the whole is prefixed directions for letter writing, and rules for composition, The",,The art of polite correspondence,,,Brookfield,E. Merriam & Co.,,1832,1832|||1832-01-01T00:00:00,,,monographic,English,text,print,"xi, 179 p. ; 15 cm.",,,Letter writing,,,,480908,,,,,University of Pittsburgh,collection.120
00z573063m,"child's book of American geography: designed as an easy and entertaining work for the use of beginners : with sixty engravings, and eighteen maps, The",,,"Goodrich, Samuel G. (Samuel Griswold), 1793-1860","Brown, George Loring, 1814-1889|||Bowen, Abel, 1790-1850",Boston,Waitt & Dow,,1832/1831,"1832|||1831|||1832, c1831|||ca. 1832-1831|||1832-01-01T00:00:00",,,monographic,English,text,print,"64 p. : ill. (Some col.), maps ; 18 cm.",,,Description and travel|||Geography|||Textbooks,1800-1870,United States|||America,,573063,,,,,University of Pittsburgh,collection.120
00z792242m,"Chesterfield's art of letter-writing simplified: being a guide to friendly, affectionate, polite and business correspondence : containing a large collection of the most valuable information relative to the art of letter-writing, with clear and complete instructions how to begin and end correspondence, rules for punctuation and spelling, &c. : to which is appended the complete rules of etiquette and the usages of society : containing the most approved rules for correct deportment in fashionable life, together with hints to gentlemen and ladies on irregular and vulgar habits, also, the etiquette of love and courtship, marriage etiquette, &c",,Art of letter-writing simplified|||Complete rules of etiquette,,,New York,Dick & Fitzgerald,,1857,c1857|||1857|||1857-01-01T00:00:00,,,monographic,English,text,print,"68, 64,16 p. ; 17 cm.",,,Letter writing|||Etiquette,,,,792242,,,,,University of Pittsburgh,collection.120
01acf7207m,"Cobb's juvenile reader no. 1: containing interesting, moral, and instructive reading lessons, composed of easy words of one and two syllables : designed for the use of small children in families and school",Juvenile reader no. 1. 1830,,"Cobb, Lyman, 1800-1864",,"Ithaca, N.Y","Andrus, Woodruff, & Gauntlett",,1830,c1830|||1830|||1830-01-01T00:00:00,,,monographic,English,text,print,72 p. : ill. ; 15 cm.,,,Readers (Primary),1800-1870,,,426991,,,,,University of Pittsburgh,collection.120
01ach2440m,"gradual primer, or, Primary school enunciator: The child's first step, taken in the right place, The",,Primary school enunciator|||The child's first step,"Tower, David B. (David Bates), 1808-1868",,New York,Daniel Burgess & Co.,,1855/1853,"1855|||1853|||1855, c1853|||ca. 1855-1853|||1855-01-01T00:00:00",,"New ed.,",monographic,English,text,print,104 p. : ill. ; 17 cm.,,,Readers (Primary),1800-1870,,juvenile,441166,,,,,University of Pittsburgh,collection.120
01z358174m,Elements of useful knowledge: containing a historical and geographical account of the United States : for the use of schools,,,"Webster, Noah, 1758-1843",,New London,"Printed for O.D. Cooke, by E.P Cady",,1807,1807|||1807-01-01T00:00:00,,,monographic,English,text,print,3 v. ; 17 cm.,,,Geography|||Textbooks|||History,"1800-1870|||Colonial period, ca 1600-1775",United States,,358174,,a 33000174,,,University of Pittsburgh,collection.120
02ach1100m,"Cobb's juvenile reader no. 2: containing interesting, moral, and instructive reading lessons, composed of words of one, two, and three syllables : designed for the use of small children, and, in connexion with No. I, to accompany the spelling book in families and schools",Juvenile reader no. 2. 1831,,"Cobb, Lyman, 1800-1864",,Baltimore,Printed and published by Joseph Jewett,,1831,1831|||1831-01-01T00:00:00,,,monographic,English,text,print,144 p. : ill. ; 15 cm.,,,Readers (Elementary),1800-1870,,,440130,,,,,University of Pittsburgh,collection.120
02ack2728m,"speller and definer, or, Class-book no. 2: designed to answer the purposes of a spelling book and to supersede the necessity of the use of a dictionary as a class-book, The",,Class-book no. 2,"Hazen, Edward.",,New York,"Lamport, Blakeman & Law",,1829,c1829|||1829|||1829-01-01T00:00:00,,179th rev. ed.,monographic,English,text,print,215 p. ; 16 cm.,,,Spellers,,,,459497,,,,,University of Pittsburgh,collection.120
03ach2155m,"Cobb's juvenile reader no. 3: containing interesting, historical, moral, and instructive reading lessons, composed of words of a greater number of syllables than the lessons in Nos. I and II, and a greater variety of composition, both in prose and poetry, selected from the writings of the best American and English authors : to which are prefixed observations on the principles of good reading : designed for the use of larger children in families and schools",Juvenile reader no. 3. 1831 (Loomis),,"Cobb, Lyman, 1800-1864",,Pittsburgh,Luke Loomis,,1831,1831|||1831-01-01T00:00:00,,,monographic,English,text,print,216 p. : ill. ; 15 cm.,,,Readers (Elementary),1800-1870,,,440884,,,,,University of Pittsburgh,collection.120
31735035516370,Epochs in American history,,,"Ellis, Edward Sylvester, 1840-1916",,Chicago,A. Flanagan,,1896,c1896|||1896|||1896-01-01T00:00:00,,,monographic,English,text,print,192 p. : ill. ; 19 cm.,,,History,,United States,,1190981,,02005754,,,University of Pittsburgh,collection.120
31735035996432,Expert shorthand speed course: teacher's handbook,,,"Blanchard, Clyde Insley, 1888-","Zoubek, Charles E. (Charles Edward), 1913-1997",New York|||Chicago|||San Francisco|||Boston|||Dallas|||Toronto|||London,The Gregg Pub. Co.,c1945,c1945,,,,monographic,English,text,print,"v, 227 p. ; 21 cm.",,,Shorthand|||Exercises for dictation,,,,1156467,,,,,University of Pittsburgh,collection.120
31735045572330,National penmanship compendium for self-instruction and for use in schools and colleges,,,"Taylor, A. D.",,New York,Horace G. Healey,,1904,1904|||1904-01-01T00:00:00,,,monographic,English,text,print,1 v. (loose leave) : ill. ; 10 x 23 cm.,,,Penmanship,,,,4008096,,,,,University of Pittsburgh,collection.120
31735056711504,"principles of English grammar: adapted to the use of common schools, The",,,"Whiting, Joseph, 1800-1845",,Detroit|||New York,A. McFarran|||Mark H. Newman,,1845/1844,"1845|||1844|||1845, c1844|||ca. 1845-1844|||1845-01-01T00:00:00",,,monographic,English,text,print,60 p. ; 19 cm.,,,English language|||Grammar,,,,360824,,,,,University of Pittsburgh,collection.120
31735057849709,Key to Pearson's Latin prose composition,,,"Inglis, Alexander James, 1879-1924",,New York,American Book Company,,1904,[1904?]|||1904|||1904-01-01T00:00:00,,,monographic,English|||Latin,text,print,105 p. ; 18 cm.,,,Latin language|||Composition and exercises,,,,398826,,,,,University of Pittsburgh,collection.120
