id,title,uniform_title,alternative_title,creator,contributor,publication_place,publisher,publication_date,encoded_date,creation_date,copyright_date,edition,issuance,language,type_of_resource,format,extent,genre,abstract,subject,temporal_coverage,geographic_coverage,target_audience,record_id,isbn,lccn,oclccn,url,depositor,collection_id
00ach7836m,"standard speaker: containing exercises in prose and poetry for declamation in schools, academies, lyceums, colleges, newly translated or compiled from celebrated orators, authors, and popular debaters, ancient and modern, a treatise on oratory and elocution, notes explanatory and biographical, The",,,"Sargent, Epes, 1813-1880",,Philadelphia,Charles Desilver,,1861/1852,"1861|||1852|||1861, c1852|||ca. 1861-1852|||1861-01-01T00:00:00",,11th ed.,monographic,English,text,print,558 p. ; 21 cm.,,,Recitations|||Readers|||Elocution,,,,445755,,,,,University of Pittsburgh,collection.120
00ach7867m,"Analytical fourth reader: containing practical directions for reading, a thorough method of thought-analysis, a critical phonic analysis of English words, and a large number of new and valuable selections in readings",,,"Edwards, Richard, 1822-1908",,New York|||Chicago,Taintor & Co.|||Geo. & C.W. Sherwood,,1867,c1867|||1867|||1867-01-01T00:00:00,,,monographic,English,text,print,264 p. : ill. ; 20 cm.,,,Readers (Elementary),,,,445786,,,,,University of Pittsburgh,collection.120
00ach7916m,"progressive pictorial primer: the engravings from original designs, The",,,"Town, Salem, 1779-1864","Holbrook, Nelson M.",Boston,Oliver & Ellsworth,,1857,c1857|||1857|||1857-01-01T00:00:00,,,monographic,English,text,print,64 p. : ill. ; 18 cm.,,,Readers (Primary),1800-1870,,,445831,,,,,University of Pittsburgh,collection.120
00ach7935m,Cyr's fifth reader,Fifth reader. 1899,,"Cyr, Ellen M., d. 1920",,Boston,Ginn & Company,,1899,1899|||1899-01-01T00:00:00,,,monographic,English,text,print,"xiv, 433 p. : ill. ; 19 cm.",,,Readers,,,,445847,,,,,University of Pittsburgh,collection.120
00acj3075m,"ladies' reader: designed for the use of schools and family reading circles : comprising choice selections from standard authors, in prose and poetry, with the essential rules of elocution, simplified and arranged for strictly practical use, The",,,"Hows, John W. S. (John William Stanhope), 1797-1871",,Philadelphia,E.H. Butler & Co.,,1864/1859,"1864|||1859|||1864, c1859|||ca. 1864-1859|||1864-01-01T00:00:00",,,monographic,English,text,print,425 p. ; 19 cm.,,,Readers,,,,450681,,,,,University of Pittsburgh,collection.120
00acj3369m,"American class book, or, A collection of instructive reading lessons: adapted to the use of schools : selected from Blair's class book, etc, The",,A collection of instructive reading lessons,"Kimber, Thomas, fl. 1815",,Philadelphia,Kimber & Richardson,,1812,1812|||1812-01-01T00:00:00,,,monographic,English,text,print,347 p. ; 19 cm.,,,Readers,,,,450967,,,,,University of Pittsburgh,collection.120
00acj3379m,"New England primer: a reprint of the earliest known edition, with many facsimiles and reproductions, and an historical introduction, The",,,,"Ford, Paul Leicester, 1865-1902",New York,"Dodd, Mead and Company",,1899,1899|||1899-01-01T00:00:00,,,monographic,English,text,print,"113 p., [18] leaves of plates, [90] p. : ill. ; 19 cm.",,,Readers (Primary)|||Printing|||History,,United States,,450977,,,,,University of Pittsburgh,collection.120
00acj4231m,Pollard's synthetic third reader,Synthetic third reader. 1892,,"Pollard, Rebecca S. (Rebecca Smith), 1831-1917",,Chicago,Western Publishing House,,1892/1890,"1892|||1890|||1892, c1890|||ca. 1892-1890|||1892-01-01T00:00:00",,,monographic,English,text,print,320 p. : ill. ; 19 cm.,,,Readers (Elementary),1870-1950,,,451792,,,,,University of Pittsburgh,collection.120
00acj4389m,"Hemans reader for female schools: containing extracts in prose and poetry, The",,The Hemans young ladies' reader,"Pinneo, T. S. (Timothy Stone), 1804-1893",,New York|||Cincinnati,"Clark, Austin, & Smith|||W.B. Smith & Co.",,1847,c1847|||1847|||1847-01-01T00:00:00,,,monographic,English,text,print,480 p. ; 19 cm.,,,Readers (Secondary),1800-1870,,,451927,,,,,University of Pittsburgh,collection.120
00acj4720m,"institute reader and normal class-book: for the use of teachers' institutes and normal schools, and for self-training in the art of reading, The",,,"Cole, William H., fl. 1870-1898",,Cincinnati,"Van Antwerp, Bragg & Co.",,1870,c1870|||1870|||1870-01-01T00:00:00,,,monographic,English,text,print,360 p. : ill. ; 20 cm.,,,Readers,,,,452190,,,,,University of Pittsburgh,collection.120
00acj4738m,McGuffey's new fourth eclectic reader: instructive lessons for the young,"Fourth eclectic reader. 1866 (Cincinnati, Philadelphia, New Orleans, New York)",New fourth eclectic reader,"McGuffey, William Holmes, 1800-1873",,Cincinnati|||Philadelphia|||New Orleans|||New York,"Wilson, Hinkle & Co.|||Claxton, Remsen & Haffelfinger|||Stevens & Seymour|||Clark & Maynard",,1866,c1866|||1866|||1866-01-01T00:00:00,,Enl. ed.,monographic,English,text,print,242 p. : ill. ; 19 cm.,,,Readers (Elementary),1800-1870,,,452208,,,,,University of Pittsburgh,collection.120
00acj4739m,"American speaker: containing numerous rules, observations, and exercises on pronunciation, pauses, inflections, accent, and emphasis : also, copious extracts in prose and poetry, calculated to assist the teacher, and to improve the pupil in reading and recitation, The",,,"Frost, John, 1800-1859",,Philadelphia,"Thomas, Cowperthwait, & Co.",,1845/1836,"1845|||1836|||1845, c1836|||ca. 1845-1836|||1845-01-01T00:00:00",,,monographic,English,text,print,448 p. ; 20 cm.,,,Recitations|||Elocution,,,,452209,,,,,University of Pittsburgh,collection.120
00acj4830m,"Southern pictorial third reader: for schools and families, The",,,"Holmes, George F. (George Frederick), 1820-1897",,New York,Richardson & Co.,,1866,c1866|||1866|||1866-01-01T00:00:00,,,monographic,English,text,print,168 p. : ill. ; 19 cm.,,,Readers (Elementary),1800-1870,,,452300,,,,,University of Pittsburgh,collection.120
00acj4849m,"girl's reading-book: in prose and poetry, for schools, The",,,"Sigourney, L. H. (Lydia Howard), 1791-1865",,New York,J. Orville Taylor,,1839/1837,"1839|||1837|||1839, c1837|||ca. 1839-1837|||1839-01-01T00:00:00",,,monographic,English,text,print,274 p. ; 19 cm.,,,Readers (Elementary),1800-1870,,,452319,,,,,University of Pittsburgh,collection.120
00acj4850m,"girl's reading-book: in prose and poetry, for schools, The",,,"Sigourney, L. H. (Lydia Howard), 1791-1865",,New York,J. Orville Taylor,,1838/1837,"1838|||1837|||1838, c1837|||ca. 1838-1837|||1838-01-01T00:00:00",,5th ed.,monographic,English,text,print,243 p. ; 16 cm.,,,Readers (Elementary),1800-1870,,,452320,,,,,University of Pittsburgh,collection.120
00acj8742m,Word-primer: a beginner's book in oral and written spelling,,,"Swinton, William, 1833-1892",,New York,"Ivison, Blakeman, Taylor & Co.",,1873,c1873|||1873|||1873-01-01T00:00:00,,,monographic,English,text,print,96 p. ; 17 cm.,,,Spellers,,,juvenile,455789,,ca 17003171,,,University of Pittsburgh,collection.120
00ack2664m,Osgood's American primary speller,American primary speller. 1873 (A.H. English & Co.),,"Osgood, Lucius.",,Pittsburgh,A.H. English & Co.,,1873,c1873|||1873|||1873-01-01T00:00:00,,,monographic,English,text,print,96 p. : ill. ; 19 cm.,,,Spellers,,,,459433,,ca 17003288,,,University of Pittsburgh,collection.120
00ack2675m,Byerly's new American spelling-book: calculated for the use of schools in the United States,New American spelling book. 1820,,"Byerly, Stephen.",,Philadelphia,M'Carty & Davis,,1820,1820|||1820-01-01T00:00:00,,,monographic,English,text,print,155 p. : ill. ; 17 cm.,,,Spellers,,,,459444,,,,,University of Pittsburgh,collection.120
00ack2687m,Osgood's progressive speller,Progressive speller. 1856,,"Osgood, Lucius.",,Pittsburgh,A.H. English & Co.,,1856,c1856|||1856|||1856-01-01T00:00:00,,,monographic,English,text,print,170 p. : ill. ; 17 cm.,,,Spellers,,,,459456,,,,,University of Pittsburgh,collection.120
00ack2700m,"United States' spelling book, with appropriate reading lessons: being an easy standard for spelling, reading and pronouncing the English language, according to the rules established by John Walker, in his critical and pronouncing dictionary, The",,,,,Pittsburgh,"Cramer, Spear and Eichbaum",,1815/1809,"1815|||1809|||1815, c1809|||ca. 1815-1809|||1815-01-01T00:00:00",,,monographic,English,text,print,156 p. ; 17 cm.,,,Spellers|||Readers|||English language|||Pronunciation,,,,459469,,,,,University of Pittsburgh,collection.120
00ack2791m,"Cobb's spelling book: being a just standard for pronouncing the English language, containing the rudiments of the English, language arranged in catechetical order, an organization of the alphabet, an easy scheme of spelling and pronunciation, intermixed with easy reading lessons : to which are added, some useful tables, with the names of cities, counties, towns, rivers, lakes, &c. in the United States, and a list of the proper names contained in the New Testament, and pronounced according to the best authorities : designed to teach the orthography and orthoepy of J. Walker",Spelling book. 1825 (Knowlton & Rice),,"Cobb, Lyman, 1800-1864","Walker, John, 1732-1807","Watertown, N.Y",Printed and published by Knowlton & Rice,,1825,c1825|||1825|||1825-01-01T00:00:00,,Rev. ed.,monographic,English,text,print,168 p. ; 18 cm.,,,Spellers,,,,459560,,,,,University of Pittsburgh,collection.120
00ack5272m,"new guide to the English tongue: in five parts, containing,  I. Words both common and proper, from one to six syllables ... II. A large and useful table of words that are the same in sound but different in signification ... III. A short but comprehensive grammar ... IV. An useful collection of sentences in prose and verse, divine, moral and historical ... V. Forms of prayer for children on several occasions, A",,,"Dilworth, Thomas, d. 1780",,Carlisle,Printed by Archibald Loudon,,1810,1810|||1810-01-01T00:00:00,,,monographic,English,text,print,132 p. : ill. ; 17 cm.,,,English language|||Grammar|||Spellers,,,,461642,,,,,University of Pittsburgh,collection.120
00acl4424m,"Dr. Scudder's tales for little readers, about the heathen",,Tales for little readers about the heathen,,American Tract Society,New York,American Tract Society,,1849,c1849|||1849|||1849-01-01T00:00:00,,,monographic,English,text,print,198 p. : ill. ; 16 cm.,Juvenile literature,,Paganism|||Religions|||Christianity and other religions|||Hinduism|||Sunday-school literature,,,,469898,,,,,University of Pittsburgh,collection.120
00acl5621m,My story book,,,,,Boston,Massachusetts Sabbath School Society,,1800/1899,[18--?]|||ca. 1800-1899|||1800-01-01T00:00:00,,,monographic,English,text,print,64 p. : ill. ; 12 cm.,,,Sunday-school literature,,,,470922,,,,,University of Pittsburgh,collection.120
00acn8305m,Cyr's fourth reader,Fourth reader. 1899,,"Cyr, Ellen M., d. 1920",,Boston,Ginn & Company,,1899,c1899|||1899|||1899-01-01T00:00:00,,,monographic,English,text,print,"viii, 388 p. : ill., ports. ; 19 cm.",,,Readers (Elementary),1870-1950,,,491421,,,,,University of Pittsburgh,collection.120
00acq4243m,"Beadle's dime American speaker: comprising gems of elocution and humor, for schools, exhibitions, parlors, etc",,,"Victor, Orville J. (Orville James), 1827-1910",,New York,Beadle and Company,,1863,c1863|||1863|||1863-01-01T00:00:00,,Rev. and enl. ed.,monographic,English,text,print,98 p. ; 17 cm.,,,Recitations,,,,506319,,54047905,,,University of Pittsburgh,collection.120
00acq4264m,"national school primer, or, primary word-builder, The",,Primary word-builder,"Watson, J. Madison (James Madison), 1827-1900",,New York,American Book Company,,1858,c1858|||1858|||1858-01-01T00:00:00,,,monographic,English,text,print,64 p. : ill. ; 18 cm.,,,Readers (Primary),1800-1870,,,506340,,,,,University of Pittsburgh,collection.120
00acy5431m,"young gentleman and lady's monitor, and English teacher's assistant: being a collection of select pieces from our best modern writers : calculated to eradicate vulgar prejudices and rusticity of manners, improve the understanding, rectify the will, purify the passions, direct the minds of youth to the pursuit of proper objects, and to facilitate their reading, writing, and speaking the English language, with elegance and propriety : particularly adapted for the use of our eminent schools and academies, as well as private persons, who have not an opportunity of perusing the works of those celebrated authors, from whence this collection is made : divided into small portions for the ease of reading in classes, The",,,"Moore, John Hamilton, d. 1807",,New York,"Printed for Evert Duyckinck, by Southwick and Crooker",,1802,1802|||1802-01-01T00:00:00,,Latest ed.,monographic,English,text,print,"vi, 382, [5] p. ; 18 cm.",,,Readers|||Youth|||Conduct of life,,,juvenile,568840,,,,,University of Pittsburgh,collection.120
00acy5488m,McGuffey's eclectic primer,Eclectic primer. 1881 (American Book Company),,"McGuffey, William Holmes, 1800-1873",,New York,American Book Company,,1881,c1881|||1881|||1881-01-01T00:00:00,,Rev. ed.,monographic,English,text,print,64 p. : ill. ; 19 cm.,,,Readers (Primary),1870-1950,,,568896,,,,,University of Pittsburgh,collection.120
00acz7897m,"Introduction to the national reader: a selection of easy lessons : designed to fill the same place in the common schools of the United States, that is held by Murray's introduction, and the compilations of Guy, Mylius, and Pinnock, in those of Great Britain",,,"Pierpont, John, 1785-1866",,New York,George F. Cooledge,,1835,c1835|||1835|||1835-01-01T00:00:00,,,monographic,English,text,print,168 p. ; 19 cm.,,,Readers,,,,580420,,,,,University of Pittsburgh,collection.120
00acz7992m,First lessons in numbers: oral and written,,,"Maglathlin, Henry B. (Henry Bartlett), 1819-1910","Greenleaf, Benjamin, 1786-1864",Boston,"Leach, Shewell, and Sanborn",,1881,c1881|||1881|||1881-01-01T00:00:00,,,monographic,English,text,print,"iv, 124 p. : ill. ; 18 cm.",Early works to 1900,,Arithmetic,,,,580512,,,,,University of Pittsburgh,collection.120
00acz8145m,"progressive third reader, for public and private schools: containing the elementary principles of elocution, illustrated by examples and exercises in connection with the tables and rules, and a series of lessons in reading : with original designs and engravings, The",,,"Town, Salem, 1779-1864","Holbrook, Nelson M.",Boston|||Portland [Me.],Bazin & Ellsworth|||Bailey and Noyes,,1857,c1857|||1857|||1857-01-01T00:00:00,,,monographic,English,text,print,304 p. : ill. ; 20 cm.,,,Readers,,,,580641,,,,,University of Pittsburgh,
00aep6688m,"Old textbooks: spelling, grammar, reading, arithmetic, geography, American history, civil government, physiology, penmanship, art, music, as taught in the common schools from colonial days to 1900",,,"Nietz, John A. (John Alfred), 1888-1970",,Pittsburgh],University of Pittsburgh Press,,1961,[1961]|||1961|||1961-01-01T00:00:00,,,monographic,English,text,print,"vii, 364 p. ports., map, facsims., tables. 24 cm.",bibliography,,Textbooks|||History,,United States,,904606,,60013851,,,University of Pittsburgh,collection.120
00aep6689m,"evolution of American secondary school textbooks: rhetoric & literature, algebra, geometry, natural history (zoology), botany, natural philosophy (physics), chemistry, Latin and Greek, French, German & world history as taught in American Latin grammar school academies and early high schools before 1900, The",,,"Nietz, John A. (John Alfred), 1888-1970",,"Rutland, Vt",C. E. Tuttle Co.,,1966,[1966]|||1966|||1966-01-01T00:00:00,,,monographic,English,text,print,"xii, 265 p. facsims., ports. 22 cm.",,,Textbooks|||History,,United States,,904607,,65020613,,,University of Pittsburgh,
00z329908m,"History of the United States: from their first settlement as colonies, to the close of the war with Great Britain in 1815 : to which are added questions, adapted to the use of schools",,,"Hale, Salma, 1787-1866",,Philadelphia,Uriah Hunt,,1835/1826,"1835|||1826|||1835, c1826|||ca. 1835-1826|||1835-01-01T00:00:00",,,monographic,English,text,print,"298, 24 p. ; 15 cm.",,,History,,United States,,329908,,06036138,,,University of Pittsburgh,collection.120
00z329961m,"history of the United States of America: on a plan adapted to the capacity of youth, and designed to aid the memory by systematick  arrangement and interesting associations : illustrated by engravings, A",,,"Goodrich, Charles A. (Charles Augustus), 1790-1862",,New York,Collins & Co.,,1825/1822,"1825|||1822|||1825, c1822|||ca. 1825-1822|||1825-01-01T00:00:00",,2nd ed.,monographic,English,text,print,"296, 20 p. : ill. ; 15 cm.",,,History,,United States,,329961,,,,,University of Pittsburgh,collection.120
00z330014m,"practical grammar of the English language, A",,,"Butler, Noble, 1819-1882",,Louisville,"John P. Morton & Co., c1846.",,1846,1846|||1846-01-01T00:00:00,,Electrotype ed.,monographic,English,text,print,254 p. ; 19 cm.,,,English language|||Grammar,,,,330014,,11004899,,,University of Pittsburgh,collection.120
00z330817m,"Geography on the productive system: for schools, academies, and families : accompanied by a large and valuable atlas",,,"Smith, Roswell Chamberlain, 1797-1875",,Hartford,Daniel Burgess & Co.|||Spalding and Storrs,,1838/1836,"1838|||1836|||1838, c1836|||ca. 1838-1836|||1838-01-01T00:00:00",,Rev. and improved.,monographic,English,text,print,247 p. : ill. ; 17 cm.,,,Geography|||Textbooks,1800-1870,,,330817,,42032793,,,University of Pittsburgh,collection.120
00z331728m,"Classical English letter-writer, or, Epistolary selections: designed to improve young persons in the art of letter-writing and in the principles of virtue and piety  : with introductory rules and observations on epistolary composition, and biographical notices of the writers from whom the letters are selected",,Epistolary selections,,,Philadelphia,Caleb Richardson,,1816,1816|||1816-01-01T00:00:00,,,monographic,English,text,print,"xxiv, 321 p. ; 19 cm.",,,English letters|||Collections|||Letter writing,,,,331728,,,,,University of Pittsburgh,collection.120
00z332218m,"young American, or, Book of government and law : showing their history, nature and necessity : for the use of schools, The",,Book of government and law,"Goodrich, Samuel G. (Samuel Griswold), 1793-1860",,New York,William Robinson,,1842,1842|||1842-01-01T00:00:00,,,monographic,English,text,print,282 p. : ill. ; 17 cm.,,,Politics and government|||Political science,,United States,,332218,,09021785,,,University of Pittsburgh,collection.120
00z333331m,"pictorial history of the United States: for schools and families, A",,,"Lossing, Benson John, 1813-1891",,New York,"F.J. Huntington, Mason Brothers",,1854,c1854|||1854|||1854-01-01T00:00:00,,,monographic,English,text,print,"343 p. : ill., ports ; 20 cm.",,,History,,United States,,333331,,02005784,,,University of Pittsburgh,collection.120
00z334080m,"young lady's accidence , or, A short and easy introduction to English grammar: designed principally for the use of young learners : more especially those of the fair sex : though proper for either, The",,A short and easy introduction to English grammar,"Bingham, Caleb, 1757-1817",,Boston,Samuel T. Armstrong,,1815,"1815, c1805|||1815|||1815-01-01T00:00:00",,20th ed.,monographic,English,text,print,60 p. ; 14 cm.,,,English language|||Grammar,,,,334080,,,,,University of Pittsburgh,collection.120
00z336193m,"improved grammar of the English language, An",,,"Webster, Noah, 1758-1843",,New Haven,Sidney Babcock,,1839/1831,"1839|||1831|||1839, c1831|||ca. 1839-1831|||1839-01-01T00:00:00",,,monographic,English,text,print,192 p. ; 19 cm.,,,English language|||Grammar,,,,336193,,,,,University of Pittsburgh,collection.120
00z339026m,Illustrated school history of the United States and the adjacent parts of America: from the earliest discoveries to the present time,,,"Quackenbos, G. P. (George Payn), 1826-1881",,New York,D. Appleton & Co.,,1857,c1857|||1857|||1857-01-01T00:00:00,,,monographic,English,text,print,"460 p. : ill., ports., maps ; 19 cm.",,,History,,United States,,339026,,02005259,,,University of Pittsburgh,collection.120
00z357226m,"system of modern geography, comprising a description of the present state of the world and its five great divisions: America, Europe, Asia, Africa, and Oceanica : with their several empires, kingdoms, states, territories, &c. ... illustrated by an atlas of sixteen maps, drawn and engraved to accompany the work, A",,Mitchell's school geography,"Mitchell, S. Augustus (Samuel Augustus), 1792-1868",,Philadelphia,"Thomas, Cowperthwait & Co.",,1840/1839,"1840|||1839|||1840, c1839|||ca. 1840-1839|||1840-01-01T00:00:00",,,monographic,English,text,print,"336 p. : ill., maps ; 17 cm.",,,Geography|||Textbooks,1800-1870,,,357226,,,,,University of Pittsburgh,collection.120
00z357387m,Lessons in geography for little learners,,,,"Quackenbos, John Duncan, 1848-1926",New York,American Book Company,,1889,c1889|||1889|||1889-01-01T00:00:00,,,monographic,English,text,print,"68 p. : ill., maps ; 19 cm.",,,Geography|||Textbooks,1870-1945,,,357387,,,,,University of Pittsburgh,collection.120
00z357449m,Peter Parley's geography for beginners: with eighteen maps and one hundred and fifty engravings,,,"Goodrich, Samuel G. (Samuel Griswold), 1793-1860",,New York,Huntington and Savage,,1845/1844,"1845|||1844|||1845, c1844|||ca. 1845-1844|||1845-01-01T00:00:00",,,monographic,English,text,print,"160 p. : ill., maps ; 15 cm.",,,Geography|||Textbooks,1800-1870,,,357449,,,,,University of Pittsburgh,collection.120
00z357466m,"easy grammar of geography: intended as a companion and introduction to the ""Geography on a popular plan for schools and young persons"" by the same author : with maps, An",,,"Phillips, R. (Richard), Sir, 1767-1840",,London,Printed for Richard Phillips,,1806,1806|||1806-01-01T00:00:00,,New ed.,monographic,English,text,print,144 p. : maps ; 14 cm.,,,Geography|||Textbooks,1800-1870,,,357466,,,,,University of Pittsburgh,collection.120
00z360346m,"Tower's common school grammar: with models of clausal, phrasal, and verbal analysis and parsing : gradually developing the construction of the English sentence",Common school grammar. 1861,,"Tower, David B. (David Bates), 1808-1868",,Boston,"Crosby, Nichols, Lee & Company",,1861/1859,"1861|||1859|||1861, c1859|||ca. 1861-1859|||1861-01-01T00:00:00",,,monographic,English,text,print,"viii, 243 p. ; 19 cm.",,,English language|||Grammar,,,,360346,,,,,University of Pittsburgh,collection.120
00z360370m,"practical new grammar, with exercises of bad English, or, An easy guide to speaking and writing the English language properly and correctly: to which is added, a curious and useful appendix, A",,An easy guide to speaking and writing the English language properly and correctly,"Fisher, A. (Anne), 1719?-1778",,Newcastle,Printed for Tho. Slack,,1780,1780|||1780-01-01T00:00:00,,"18th ed., enl. and much improved.",monographic,English,text,print,"xii, 180 p. ; 17 cm.",Early works to 1800,,English language|||Grammar,,,,360370,,,,,University of Pittsburgh,collection.120
00z360511m,"First lessons in our country's history: bringing out its salient points, and aiming to combine simplicity with sense",,Swinton's primary United States,"Swinton, William, 1833-1892",,New York,"Ivison, Blakeman, Taylor, & Company",,1872,c1872|||1872|||1872-01-01T00:00:00,,,monographic,English,text,print,"viii, 119 p. : ill., maps ; 18 cm.",,,History,,United States,,360511,,,,,University of Pittsburgh,collection.120
00z360707m,"pictorial history of the United States: with notices of other portions of America, A",,,"Goodrich, Samuel G. (Samuel Griswold), 1793-1860",,New York|||Cincinnati,"Huntington and Savage, Mason and Law|||H.W. Derby & Company",,1850/1843,"1850|||1843|||1850, c1843|||ca. 1850-1843|||1850-01-01T00:00:00",,Rev. and improved ed.,monographic,English,text,print,"viii, 360 p. : ill., maps ; 19 cm.",,,History,,United States|||America,,360707,,,,,University of Pittsburgh,collection.120
00z398954m,"new universal letter writer: containing letters on duty, amusement, love, courtship, marriage, friendship, trade, religion, and other useful subjects, The",,,"Cook, Thomas.",,Montpelier,Lucius Q.C. Bowles,,1816,1816|||1816-01-01T00:00:00,,,monographic,English,text,print,288 p. ; 17 cm.,,,Letter writing,,,,398954,,,,,University of Pittsburgh,collection.120
00z411590m,"Palmer method of business writing: a  series of self-teaching in rapid, plain, unshaded, coarse-pen, muscular movement writing, The",,,"Palmer, A. N. (Austin Norman), 1859-1927",,New York,A.N. Palmer Company,,1915,1915|||1915-01-01T00:00:00,,,monographic,English,text,print,95 p. : ill. ; 15 x 24 cm.,,,Penmanship,,,,411590,,,,,University of Pittsburgh,collection.120
00z412377m,"Penmanship explained, or, The principles of writing reduced to an exact science",,,"Potter, S. A.",,Philadelphia,Cowperthwait & Co.,,1868/1866,"1868|||1866|||1868, 1866|||ca. 1868-1866|||1868-01-01T00:00:00",,,monographic,English,text,print,"123 p., [6] pages of plates : ill. ; 19cm.",,,Penmanship,,,,412377,,,,,University of Pittsburgh,collection.120
00z412637m,"New vertical script primer, The",,,,,New York : Potter & Putnam,,,1898,"1898|||1898, c1895|||1898|||1898-01-01T00:00:00",,,monographic,English,text,print,48 p. : ill. ; 20 cm.,,,"Penmanship, Vertical",,,,412637,,,,,University of Pittsburgh,collection.120
00z418146m,Cornell's primary geography: forming part first of a systematic series of school geographies,Primary geography. 1855,,"Cornell, S. S. (Sophia S.)",,New York,D. Appleton & Company,,1855/1854,"1855|||1854|||1855, c1854|||ca. 1855-1854|||1855-01-01T00:00:00",,,monographic,English,text,print,"98 p. : ill., maps ; 23 cm.",,,Geography|||Textbooks,1800-1870,,,418146,,,,,University of Pittsburgh,collection.120
