id,title,uniform_title,alternative_title,creator,contributor,publication_place,publisher,publication_date,encoded_date,creation_date,copyright_date,edition,issuance,language,type_of_resource,format,extent,genre,abstract,subject,temporal_coverage,geographic_coverage,target_audience,isbn,lccn,oclccn,url
9917968083406236,"general practise of physick: containing all inward and outward parts of the body, with all the accidents and infirmities that are incident unto them, even from the crown of the head to the sole of the foot : also by what means (with the help of God) they may be remedied, very meet and profitable, not onely for all physitians, chirurgions, apothecaries, and midwives, but for all other estates whatsoever, the like whereof as yet in English hath not been published, The",New Artzney Buch. English,,"Wirsung, Christof, 1500 or 1505-1571",,London,"Printed for J.L., Henry Hood, Abel Roper, and Richard Tomlins, and are to be sold at their shops ...",1654,,,,"And now in this fourth and last edition are very many additions added by some of our English physitians, which you may know by this mark [hand].",monographic,English,text,microfilm|||microform|||microfilm reel,"[20], 818 [i.e. 820], [123] p.",,,Medicine|||Early works to 1800,,,,,,16994351,
9917978683406236,"general practise of physick: containing all inward and outward parts of the body, with all the accidents and infirmities that are incident unto them, even from the crown of the head to the sole of the foot : also by what means (with the help of God) they may be remedied, very meet and profitable, not onely for all physitians, chirurgions, apothecaries, and midwives, but for all other estates whatsoever, the like whereof as yet in English hath not been published, The",New Artzney Buch. English,,"Wirsung, Christof, 1500 or 1505-1571",,London,"Printed for J.L. for Luke Fawn, and are to be sold at his shop ...",1654,,,,"And now in this fourth and last edition are very many additions added by some of our English physitians, which you may know by this mark [hand].",monographic,English,text,microfilm|||microform|||microfilm reel,"[20], 818 [i.e. 820], [123] p.",,,Medicine|||Early works to 1800,,t-v-,,,,17892293,
9917751643406236,"Culpeper's last legacy: left and bequeathed to his dearest wife, for the publicke good : being the choicest and most profitable of those secrets which while he lived were lockt up in his breast, and resolved never to be publisht till after his death : containing sundry admirable experiences in severall sciences, more especially in chyrurgery and physick ... : with two particular treatises, the one of feavers, the other of pestilence, as also other rare and choice aphorisms ... never publisht before in any of his other works",,,"Culpeper, Nicholas, 1616-1654",,London,Printed for N. Brooke ...,1655,,,,,monographic,English,text,microfilm|||microform|||microfilm reel,"[7], 48 p., [4], 73 p., [4], 144 [i.e. 140] p. : port.",,,Medicine|||Early works to 1800|||Aphorisms|||Anatomy,,,,,,12234213,
9917598313406236,"pisse-prophet, or, Certain pisse-pot lectures: wherein are newly discovered the old fallacies, deceit, and jugling of the pis-pot science used by all those (whether quacks, and empiricks, or other methodical physicians) who pretend knowledg of diseases by the urine in giving judgement of the same, The",,Certain pisse-pot lectures,"Brian, Thomas.",,London,Printed by S.G. for R. Thrale and are to be sold at his shop,1655,,,,,monographic,English,text,microfilm|||microform,"[11], 155 [ie, 180] p.",,,Urine|||Examination|||Early works to 1800|||Medicine,,,,,,07911680,
9917679863406236,"practice of physick in seventeen several books: wherein is plainly set forth the nature, cause, differences, and several sorts of signs : together with the cure of all diseases in the body of man, The",Praxis medica. English. 1655,The compleat practice of physick in eighteen several books,"Rivière, Lazare, 1589-1655","Culpeper, Nicholas, 1616-1654|||Cole, Abdiah, ca. 1610-ca. 1670|||Rowland, William.",London,Printed by Peter Cole ... and are to be sold at his shop ...,1655,,,,,monographic,English|||Latin,text,microfilm|||microform|||microfilm reel,"[16], 645 [i.e. 518], [17] p.",,,Medicine|||Early works to 1800,,,,,,11781600,
9917846043406236,"Closet for ladies and gentlewomen, or, The Art of preserving, conserving, and candying: with the manner how to make divers kindes of syrups, and all kindes of banqueting-stufs : also divers soveraign-medicines and salvs, A",,"Art of preserving, conserving, and candying",,,London,Printed by R.H.,1656,,,,"Corrected, amended, and much enlarged, by adding a very usefull-table thereunto.",monographic,English,text,microfilm|||microform|||microfilm reel,"[22], 84 leaves.",,,"Canning and preserving|||Early works to 1800|||Medicine, Popular",,,,,,12734986,
9917897683406236,"Tabidorum theatrum, sive, Pthisios, atrophiæ, & hecticæ xenodochium",,"Tabidorum theatrum|||Theatri tabidorum vestibulum|||Theatri tabidorum|||Pthisios, atrophiae, & hecticae xenodochium|||Pthisios, atrophiae, et hecticae xenodochium","Bennet, Christopher, 1617-1655","Lluelyn, Martin, 1616-1682|||Bennet, Christopher, 1617-1655",London,"Typis Tho. Newcomb, impensis Sam. Thompson ...",1656,,,,,monographic,Latin,text,microfilm|||microform|||microfilm reel,"[23], 187, [5] p., [4] leaves of plates : ill., port.",,,Tuberculosis|||Early works to 1800|||Medicine,,,,,,13195863,
9935478153406236,"Skilful physician: containing Directions for the preservation of a healthful condition, and approved remedies for all diseases and infirmities (outward or inward) incident to the body of man with a right manner of applying them to the several humours, constitutions, and strength of every patient ... whereunto is added experimented instructions for the compounding of Perfumes, also for the chusing and ordering of all kinds of Wines, both in preserving the sound and rectifying those that are prick'd, The",,Directions for the preservation of health|||Knowledge and ordering of wines|||Perfumes,,,London,Printed by Tho. Maxey for Nath Ekins,1656,,,,,monographic,English,text,print|||unmediated|||volume,"[48], 410 pages ; 15 cm",Early works to 1800|||text,,Medicine|||Herbals|||Naturopathy|||Herbal Medicine,,,,,,ocm41964048,
9917968763406236,"skilful physician: containing directions for the preservation of a healthful condition, and approved remedies for all diseases and infirmities (outward or inward) incident to the body of man ... whereunto is added experimented instructions for the compounding of perfumes, also for the chusing and ordering of all kinds of wines, both in preserving the sound, and rectifying those that are prick'd : never before imparted to publick view, The",,,D. D.,,London,Printed by Tho. Maxey for Nath. Ekins ...,1656,,,,,monographic,English,text,microfilm|||microform|||microfilm reel,"[46], 410 p.",,,Medicine|||Early works to 1800,,,,,,17007241,
9917979493406236,"experimental treatise of surgerie: in four parts : 1. The first part shewing the dangerous abuses committed among the modern surgeons, 2. Of cures of all sorts of wounds in mans body ..., 3. Of the symptomes of wounds ..., 4. Treating of all kinds of balmes, salves, plaisters, ointments, oyles, bloodstenchers, potions, tents, corrosives, &c. which are used for wounds, An",Practica der Wundartzney. English|||Childrens book of Felix Wurtz,,"Wurtz, Felix, 1517 or 18-1574 or 75","Fox, Abraham Lenertzon.|||Wurtz, Rodolf.|||Wurtz, Felix, 1517 or 18-1574 or 75",London,Printed by Gartrude Dawson ... and are to be sold by the book-sellers shops,1656,,,,,monographic,English|||Dutch|||German,text,microfilm|||microform|||microfilm reel,"[20], 199, [1], 217-366 p.",,,Medicine|||Early works to 1800,,,,,,18111698,
9917609413406236,"Composita, or, A synopsis of the chiefest compostitions in use now with Galenists",,A synopsis of the chiefest compostitions in use now with Galenists,"Culpeper, Nicholas, 1616-1654",,London,Printed by T.C. for Nath. Brook,1656,,,,,monographic,English,text,microfilm|||microform,"[1], 144, [8] p.",,,Medicine|||Early works to 1800|||Aphorisms|||Therapeutics,,,,,,08647937,
9917612653406236,"Culpepers physical and chymicall way of curing the most difficult and incurable diseases: with a catalogue of the cures performed by the rare medicaments of George Phedro, a famous physitian",,,"Phaedro, Georg.","Culpeper, Nicholas, 1616-1654",London,Printed for William Shears Junior,1656,,,,,monographic,English,text,microfilm|||microform,"[14], 133.",,,Medicine|||Early works to 1800,,,,,,08794032,
9917908973406236,"Helmont disguised, or, The vulgar errours of impericall and unskillfull practisers of physick confuted: more especially as they concern the cures of the feavers, stone, plague and other diseases : in a dialogue between philiatrus, and pyrosophilus : in which the chief rarities of physick is admirably discoursed of",,Helmont disguised|||The vulgar errours of impericall and unskilful practicers of physick confuted,"Thompson, James, Student in physick",,London,"Printed by E. Alsop, for N. Brook and W. Leybourn ...",1657,,,,,monographic,English,text,microfilm|||microform|||microfilm reel,"[8], 134 p.",,,"Fever|||Eclectic treatment|||Medicine|||Early works to 1800|||Helmont, Franciscus Mercurius van 1614-1699",,,,,,13446980,
9939755313406236,"Constitutiones, capitula, jurisdictiones, ac pandectae Regii Protomedicatus officii",,Consitutiones protomedicales|||Constitutiones ... Regii Protomedicatus officii ... Siciliae Regni,,"Sicily (Italy), Protomedico.|||Alessandris, Antonio d', fl. ca. 1440|||Ingrassia, Giovanni Filippo, 1510-1580|||Pizzuto, Paolo, d. 1684",Palermo,Ex typographia Nicolai Bua,1657,,,,,monographic,Latin|||Italian,text,print,"238, [22] p. ; 20 cm.",Early works to 1800,,Medical laws and legislation|||Medicine,,Italy|||Sicily,,,,ocm14301338,
9917688673406236,"Select observations on English bodies, or, Cures both empericall and historicall performed upon very eminent persons in desperate diseases",,Select observations on English bodies|||Cures both empericall and historicall,"Hall, John, 1575-1635","Cooke, James, 1614-1694",London,Printed for John Sherley ...,1657,,,,,monographic,English,text,microfilm|||microform|||microfilm reel,"[24], 316 p.",,,Medicine|||Early works to 1800|||Diseases,,,,,,11862012,
9917709593406236,"Natures explication and Helmont's vindication, or, A short and sure way to a long and sound life: being a necessary and full apology for chymical medicaments, and a vindication of their excellency against those unworthy reproaches cast on the art and its professors ... by Galenists, usually called Methodists",,A short and sure way to a long and sound life,"Starkey, George, 1627-1665","Helmont, Franciscus Mercurius van, 1614-1699",London,Printed by E. Cotes for Thomas Alsop ...,1657,,,,,monographic,English,text,microfilm|||microform|||microfilm reel,"[64], 336 p.",,,"Medicine, Magic, mystic, and spagiric|||Early works to 1800",,,,,,12001265,
9917728003406236,"expert doctors dispensatory: the whole art of physick restored to practice : the apothecaries shop and chyrurgions closet open'd ... : together with a strict survey of the dispensatories of the most renowned colledges of the world ... : to which is added by Jacob A. Brunn ... a compendium of the body of physick, wherein all the medicaments vniversal and particular, simple and compound, are fitted to the practice of physick, The",Methodus praescribendi formulas remediorum elegantissima. English,The whole art of physick restored to practice|||The apothecaries shop and chyrurgions closet open'd|||The expert doctors dispensatory,"Morel, Pierre.","Brunn, Johannes Jacobus, 1591-1660|||Culpeper, Nicholas, 1616-1654",London,Printed for N. Brook ...,1657,,,,,monographic,English|||Latin,text,microfilm|||microform|||microfilm reel,"[30], 471, [9] p.",,,Medicine|||Early works to 1800|||Pharmacy,,,,,,12111256,
9917739863406236,"expert phisician: learnedly treating of all agues and feavers, whether simple or compound, shewing their different nature, causes, signes, and cure, The",Pharmacopée. English,,"Bauderon, Brice, approximately 1540-1623","Welles, Benjamin, 1615 or 16-1678",London,by R.I. for John Hancock ...,1657,,,,,monographic,English,text,microfilm|||microform|||microfilm reel,"[14], 160 p. : port.",,,Fever|||Medicine|||Early works to 1800,,,,,,12172216,
9917745113406236,"idea of practical physick: in twelve books, The",Idea universal medicinae practicae libris XII absoluta. English,,"Jonstonus, Joannes, 1603-1675","Culpeper, Nicholas, 1616-1654",London,Printed by Peter Cole ...,1657,,,,,monographic,English|||Latin,text,microfilm|||microform|||microfilm reel,[372] p.,,,Medicine|||Early works to 1800,,,,,,12196294,
9917766253406236,"Organon salutis: an instrument to cleanse the stomach : as also divers new experiments of the virtue of tobacco and coffee, how much they conduce to preserve humane health",,,"W. R. (Walter Rumsey), 1584-1660","Blount, Henry, Sir, 1602-1682|||Howell, James, 1594?-1666",London,Printed by R. Hodgkinsonne for D. Pakeman ...,1657,,,,,monographic,English,text,microfilm|||microform|||microfilm reel,"[24], 56 p.",,,Medicine|||Early works to 1800|||Tobacco|||Coffee,,,,,,12270499,
9917784293406236,"charitable physitian, his hand extended to the curing of that contagious disease called the flux, or griping of the guts: with other the most violent distempers now reigning amongst us, also their symptomes, whereby they are known, The",,,"Deacon, J. (John)",,London,"Printed by W.G., are to be sold by Isaac Pridme ... and for the author ...",1657,,,,,monographic,English,text,microfilm|||microform|||microfilm reel,"[3], 5-24 p.",,,"Medicine|||Formulae, receipts, prescriptions|||Early works to 1800",,,,,,12354590,
9935302333406236,"expert phisician: learnedly treating of all agues and feavers, whether simple or compound : shewing their different nature, causes, signes, and cure, viz ... [et al.], The",,Expert physician,"Bauderon, Brice, approximately 1540-1623",,London,R.I. for J. Hancock,1657,,,,,monographic,English,text,print,"[8] leaves, 160 p. : engr. front. (port.) ; 16 cm.",Early works to 1800,,"Medicine|||Fever|||History, 17th Century",,,,,,23805355,
9917936753406236,"Physical dictionary, or, An Interpretation of such crabbed words and terms of arts, as are deriv'd from the Greek or Latin, and used in physick, anatomy, chirurgery, and chymistry: with a definition of most diseases incident to the body of man, and a description of the marks and characters used by doctors in their receipts, A",,"A Physical dictionary|||An Interpretation of such crabbed words and terms of arts, as are deriv'd from the Greek or Latin",,,London,Printed by G.D. for John Garfield ...,1657,,,,,monographic,English,text,microfilm|||microform|||microfilm reel,[221] p.,Dictionaries|||dictionary,,Medicine|||Early works to 1800|||Science,,,,,,14509818,
9934169543406236,"universal body of physick: in five books, comprehending the several treatises of nature, of diseases and their causes, of symptomes, of the preservation of health, and of cures, The",,,"Rivière, Lazare, 1589-1655","Carr, William, fl. ca.1655-1657",London,printed for Henry Eversden at the Greyhound in Pauls Church-yard,1657,,,,,monographic,English|||Latin,text,print,"[18], 417 p., [5], [2] folded l. of plates : charts ; 28 cm.",,,"Medicine|||Early works to 1800|||History|||History, 17th Century|||Therapeutics",17th century,,,,,11229081,
9917598743406236,Culpeper's last legacy: left and bequeathed to his dearest wife for the publike good : being the choicest and most profitable of those secrets which while he lived were lockt up in his breast and resolved never to be publisht till after his death : containing sundry admirable experiences in severall sciences more especially in chyrurgery and physick,,"Culpeper's legacy, his physical, chyrurgical remains","Culpeper, Nicholas, 1616-1654",,London,Printed for N. Brooke,1657,,,,,monographic,English,text,microfilm|||microform,"234 p. in various pagings, [1] leaf of plates : port.",,,Medicine|||Early works to 1800|||Therapeutics|||Aphorisms and apothegms,,,,,,07915991,
9917847743406236,"Queens closet opened: incomparable secrets in physick, chyrurgery, preserving, candying, and cookery, as they were presented unto the Queen by the most experienced persons of our times, many whereof were honoured with her own practise, when she pleased to descend to these more private recreations, The",,"A queen's delight|||The art of preserving, conserving and candying",W. M.,,London,Printed for Nathaniel Brooke,1658,,,,"The fourth edition corrected, with many additions : together with three exact tables, one of them never before printed.",monographic,English,text,microfilm|||microform|||microfilm reel,"[10], 300, [23] p.",Early works to 1800,,"Formulas, recipes, etc|||Cooking|||Medicine, Popular",,,,,,12743381,
9917897563406236,"Aditus novus ad occultas sympathiæ et antipathiæ causas inveniendas: per principia philosophiæ naturalis, ex fermentorum artificiosâ anatomia hausta, patefactus",,,"Rattray Sylvester, fl. 1650-1666",,Glasgow,Excudebat Andreas Anderson,1658,,,,,monographic,Latin,text,microfilm|||microform|||microfilm reel,"[15], 135 p.",,,Medicine|||Early works to 1800|||Sympathy (Physiology),,,,,,13194920,
9917724593406236,"secret miracles of nature: in four books : learnedly and moderately treating of generation, and the parts thereof, the soul, and its immortality, of plants and living creatures, of diseases, their symptoms and cures, and many other rarities ... : whereunto is added one book containing philosophical and prudential rules how man shall become excellent in all conditions, whether high or low, and lead his life with health of body and mind, The",De miraculis occultis naturae. English,,"Lemnius, Levinus, 1505-1568",,London,"Printed by Jo. Streater, and are to be sold by Humphrey Moseley ... John Sweeting ... John Clark ... and George Sawbridge ...",1658,,,,,monographic,English|||Latin,text,microfilm|||microform|||microfilm reel,"[16], 398 p.",,,Medicine|||Early works to 1800|||Occultism,,,,,,12090259,
9917729593406236,"Choice and rare experiments in physick and chirurgery, or, A discovery of most approved medicines for the curing of most diseases incident to the body of men, women, and of children: together with an antidotary of experiments never before published",,A discovery of most approved medicines for the curing of most diseases,"Collins, Thomas, Student in physick",,London,Printed by J.T. for Francis Eglesfield ...,1658,,,,,monographic,English,text,microfilm|||microform|||microfilm reel,"[14], 210 p.",,,Medicine|||Early works to 1800,,,,,,12117547,
9917936923406236,"Four books of that learned and renowned doctor, Lazarus Riverius: containing five hundred and thirteen observations, or histories, of famous and rare cures ... : unto which is added a fift[h] book, being Select medicinal counsels of John Fenelius",Observationes medicae et curationes insignes. English,,"Rivière, Lazare, 1589-1655","Fernel, Jean, 1497-1558|||Culpeper, Nicholas, 1616-1654",London,Printed by Peter Cole ...,1658,,,,,monographic,English|||Latin,text,microfilm|||microform|||microfilm reel,"[16], 645 p.",,,Medicine|||Early works to 1800,,,,,,14514332,
9918847123406236,"Aur Philip Theoph Paracelsi Bombast ab Höenheim Opera omnia: medico-chemico-chirurgica, tribus voluminibus comprehensa",,,"Paracelsus, 1493-1541",,Geneva,I. Antonii & S. de Tournes,1658,,,,,monographic,Latin,text,microform|||microopaque,3 v. ; 34 cm.,,,Medicine|||Early works to 1800,,,,,,08101232,
9917843583406236,"Pharmacopœia Londinensis, or, The London dispensatory further adorned by the studies and collections of the fellows, now living of the said colledg: in this sixt edition you may find, 1. three hundred useful additions, 2. all the notes that were in the margent are brought into the book between two such crotchets at these [ ], 3. on the top of the pages of this impression is printed, the sixt edition, much enlarged, 4. the vertues, qualities, and properties of every simple, 5. the vertues and use of the compounds, 6. cautions in giving al medicines that are dangerous, 7. all the medicines that were in the old Latin dispensatory, and are left out in the new Latin one, are printed in this sixt impression in English, with their vertues, 8. a key to Galen's Method of physick, containing thirty three chapters, 9. in every page two columns, 10. in this impression, the Latin name of every one of the compounds is printed, and in what page of the new folio Latin book they are to be found",Pharmacopoeia Londinensis. English,Pharmacopœia Londinensis|||The London dispensatory further adorned by the studies|||A key to Galen's Method of physick,,"Royal College of Physicians of London|||Culpeper, Nicholas, 1616-1654",London,Printed by Peter Cole ...,1659,,,,Sixt[h] edition.,monographic,English|||Latin,text,microfilm|||microform|||microfilm reel,"[26], 341, [5], 343-377, [33] p.",,,Pharmacopoeias|||Dispensatories|||Medicine|||Early works to 1800,,England,,,,12720586,
9917915573406236,"works of that famous physitian Dr. Alexander Read, The",,,"Read, Alexander, 1586?-1641",,London,"Printed by E.T. for Richard Thrale, and are to be sold at his shop ...",1659,,,,The third edition.,monographic,English,text,microfilm|||microform|||microfilm reel,"[19], 524, [15] p.",,,Medicine|||Early works to 1800|||Practice,,,,,,13556659,
9917706943406236,"Culpeper's school of physick, or, The experimental practice of the whole art: wherein are contained all inward diseases from the head to the foot, with their proper and effectuall cures, such diet set down as ought to be observed in sickness or in health : with other safe wayes for preserving of life",School of physick,The experimental practice of the whole art|||The nativity of Nicholas Culpeper,"Culpeper, Nicholas, 1616-1654","Gadbury, John, 1627-1704",London,Printed for N. Brook ...,1659,,,,,monographic,English,text,microfilm|||microform|||microfilm reel,"[54], 361 [i.e. 461], [27] p. : ill., port.",,,"Medicine|||Early works to 1800|||Formulae, receipts, prescriptions",,,,,,11987085,
9917766353406236,"nature of the drink kauhi, or coffe, and the berry of which it is made, The",Tadhkirat ūlī al-albāb,,"Anṭākī, Dāwūd ibn ʻUmar, d. 1599",,Oxford,Printed by Henry Hall,1659,,,,,monographic,English|||Arabic,text,microfilm|||microform|||microfilm reel,[8] p.,,,"Coffee|||Early works to 1800|||Medicine, Arab",,,,,,12270940,
9917936743406236,"Pharmacopœa Belgica, or, The Dutch dispensatory: wherein is described I. the vertues, qualities, and properties of every simple",The compleat herbalist,The Dutch dispensatory|||Pharmacopoae Belgica,,,London,Printed by E.C. for Edw. Farnham ... and Robert Horn ...,1659,,,,,monographic,English,text,microfilm|||microform|||microfilm reel,"[8], 428 p.",,,"Pharmacology|||Early works to 1800|||Medicine, Botanic|||Medicinal plants",,,,,,14509245,
9918011393406236,"XCIX canons, or rules: learnedly describing an excellent method for practitioners in physick",,,"Macollo, John, 1576?-1622",,London,J. Grismond,1659,,,,,monographic,English|||Scottish Gaelic,text,microfilm|||microform|||microfilm reel,"[8], 112 p.",,,Medicine|||Early works to 1800,,,,,,27411958,
9917600293406236,"Queens closet opened: incomparable secrets in physick, chyrurgery, preserving, and candying &c. which were presented unto the queen, The",,"A Queens delight|||The art of preserving, conserving and candying",,,London,Printed for Nath. Brooke,1659,,,,Corrected and revised with many additions,monographic,English,text,microfilm|||microform,"[8], 300, [23] p.",Early works to 1800,,"Formulas, recipes, etc|||Medicine, Popular|||Cooking",,,,,,07940359,
9917644633406236,"Short method of physick: shewing the cure of fourty-five severall diseases which are the generall and most inclined to men and womens bodyes, A",,,,,London,Printed by M.S. for Thomas Jenner,1659,,,,,monographic,English,text,microfilm|||microform|||microfilm reel,"[2], 40 p. : ill.",,,Medicine|||Early works to 1800,,,,,,10526007,
9917647793406236,"exact collection of the choicest and more rare experiments and secrets in physick and chyrurgery (both cymick and Galenick): viz. of Leonard Phioravant, Knight and doctour in physick and chyrurgery, his Rational secrets and chyrurgery &c. : whereunto is annexed Paracelsus's One hundred and fourteen experiments : with certain excellent works of G.B. à ortu Aquitano ; also Isaac Holandus, his secrets concerning his vegetal and animal work : with Quercetanus his Spagyrick antidotary for gun-shot : also certain collections out of some manuscripts of Dr. Edwards and other physitians of note, An",,,"Fioravanti, Leonardo, 1517-","Penot, Bernard Georges, d. 1617?|||Hollandus, Johan Isaäc, active 15th century",London,Printed for William Shears,1659,,,,,monographic,English,text,microfilm|||microform|||microfilm reel,703 p. in various pagings.,,,Medicine|||Early works to 1800,,,,,,10700843,
9917873343406236,"Medicus microcosmus, seu, Spagyria microcosmi: exhibens medicinam corpore hominis tùm vivo, tùm extincto doctè eruendam, scitè præparandam, & dextrè propinandam",Medicus microcosmus,Medicus microcosmus|||Spagia microcosmi,"Beckher, Daniel, 1594-1655",,London,"Prostant apud Jo. Martin, Ja. Allestry & Tho. Dicas ...",1660,,,,Editio nova triplo auctior & correctior.,monographic,Latin,text,microfilm|||microform|||microfilm reel,"[33], 304, [23] p.",,,Medicine|||Early works to 1800|||Anatomy|||Therapeutics,,,,,,12940181,
