id,title,uniform_title,alternative_title,creator,contributor,publication_place,publisher,publication_date,encoded_date,creation_date,copyright_date,edition,issuance,language,type_of_resource,format,extent,genre,abstract,subject,temporal_coverage,geographic_coverage,target_audience,isbn,lccn,oclccn,url
9917908143406236,"Markhams method or epitome: wherein [is] shewed his approved remedies for all diseases whatsoever incident to horses, and they are almost 300 all cured with twelve medicines onely, not of twelve pence cost, and to be got commonly everywhere : also for curing of all oxen, kine, bulls, calves, sheep, lambs, goats, swine, dogs ... and other creatures serviceable for the use of man",,,"Markham, Gervase, 1568?-1637",,London,"Printed by Ja. Cottrel for John Harrison, and are to be sold at his shop ...",1650,1984,,,The seventh edition /,monographic,English,text,microfilm|||microform|||microfilm reel,"[8], 88 p. : ill.",,,Veterinary medicine|||Early works to 1800|||Horses|||Diseases,,,,,,13419804,
9917923043406236,"universal body of physick: in five books : comprehending the several treatises of nature, of diseases and their causes, of symptomes, of the preservation of health, and of cures, The",Institutiones medicae. English,,"Rivière, Lazare, 1589-1655","Carr, William.",London,Printed for Henry Eversden ...,1657,1980,,,,monographic,English|||Latin,text,microfilm|||microform|||microfilm reel,"[18], 417, [5] p.",,,Physiology|||Early works to 1800|||Medicine,,,,,,13657323,
9917576193406236,"Orders, thought meete by Her Maiestie, and her Priuie Councell, to be executed throughout the counties of this realme, in such townes, uillages, and other places, as are, or may be hereafter infected with the plague, for the stay of further increase of the same: also, An aduise set downe vpon Her Maiesties expresse commaundement, by the best learned in physicke within this realme, contayning sundry good rules and easie medicines, without charge to the meaner sort of people, as well for the preseruation of her good subiects from the plague before infection, as for the curing and ordring of them after they shalbe infected",,Advise set downe upon Her Maiesties expresse commandement,,"England and Wales, Sovereign (1558-1603 : Elizabeth I)|||England and Wales, Privy Council.",London,"By Christopher Barker ..., [1578?]",1578,1983,,,,monographic,English,text,microfilm|||microform|||microfilm reel,[26] p.,,,Plague|||Prevention|||Medicine|||Early works to 1800,,England,,,,22354456,
999734283406236,"Conspectvs medicinae theoretico-practicae: tabvlis cxxxviii omnes primarios morbos methodo Stahliana tractandos, exhibens, tertia vice editvs, correctvs et avctvs, cvm indice satis locvplete et paraefatione excell. Stahlii, ... / avctore D. Ioanne Ivnckero",,,"Juncker, Johann, 1679-1759","Stahl, Georg Ernst, 1660-1734",Hall,"Impensis Orphanotrophei, 1734.",1734,1734,,,,monographic,Latin,text,print,"1032, [132] p. ; 22 cm.",,,Medicine|||History|||Pathology|||Early works to 1800,18th century,,,,,07966015,
9934254273406236,Opera omnia in compendium redacta / Michaelis Ettmulleri,,,"Ettmüller, Michael, 1644-1683",,Venice,"Gabrielem Hertz, 1727.",1727,1727,,,Editio novissima.,monographic,Latin,text,print,"xvi, 454 p.; 25 cm.",,,Medicine|||Early works to 1800,,,,,,06693796,
9918870543406236,Osualdi Crolli Veterani Hassi Basilica chymica: philosophicam propriâ laborum experientiâ confirmatum descriptionem et usum remediorum chymicorum selectissimorum é lumine gratiæ et naturæ desumptorum : in fine libri additus est autoris ejusdem Tractatus nouus de signaturis rerum internis,,"Basilica chymica|||Tractatvs de signaturis internis rerum, seu, De vera et viva anatomia majoris & minoris mundi|||De vera et viva anatomia majoris & minoris mundi","Croll, Oswald, 1580-1609","Hartmann, Johann, 1568-1631|||Bollinger, Ulrich, fl. 1609",Frankfurt,Impensis Godefirdi Tampachii,1609,1608,,,,monographic,Latin,text,microform|||microopaque,"[16], 283, [25], 80, [8], 20 p. : ill. ; 24 cm.",bibliography,,Pharmacy|||Early works to 1800|||Therapeutics|||Signatures (Medicine),,,,,,08732288,
9917692833406236,"Coral and steel, a most compendious method of preserving and restoring health, or, A rational discourse grounded upon experience: practically shewing how most diseases may be both prevented and cured, either solely or chiefly by two common medicaments, viz. red coral and steel",,,"R. B., M. D",,London,"Printed for the authour, and are to be sold by Simon Miller ...",1700,1962,,,,monographic,English,text,microfilm|||microform|||microfilm reel,"[18], 116, [2] p.",,,"Medicine|||Formulae, receipts, prescriptions|||Early works to 1800",,,,,,11892722,
9917779343406236,"appendix to The unlearned alchimist: wherein is contained the true receipt of that excellent diaphoretick and diuretick pill, purging by sweat and urine, commonly known by the name of Matthew's pill : with the exact manner of preparing and making of it, and the particular nature and virtue of the several ingredients, as also of the pill, An",,,"Kendall, George, 1610-1663","Mathews, Richard, d. 1661",London,Printed for Joseph Leigh and are to be sold by him ... and are to be sold by the author ...,1664,1664,,,,monographic,English,text,microfilm|||microform|||microfilm reel,"[8], 54 p.",,,"Medicine|||Formulae, receipts, prescriptions|||Alchemy|||Early works to 1800",,,,,,12327950,
9917848043406236,"warming-stone, first found out by Sir Richard Carew, Baronet: who was himself cured of several distempers by it and by the use thereof cured many thousands in the west, and since experienced thirty and five years for the cure of all colds, fluxes, collicks, aches ... and to restore natural heat in aged and weak persons ... : formerly sold by John Bartlet, bookseller, and now onely to be had at the shop of Thomas Rooks, The",,The warming stone,"Carew, Richard, Sir, -1643?",,London,Printed for Thomas Rooks ...,1670,1670,,,,monographic,English,text,microfilm|||microform|||microfilm reel,16 p.,,,Traditional medicine|||Early works to 1800,,England,,,,12744605,
9917637763406236,"Every man his own doctor: in two parts, shewing I. how every one may know his own constitution by certain signs, also the nature and faculties of all food as well as meats as drinks ... : the second part shews the full knowledge and cure of the pox, running of the reins, gout, dropsie, scurvy, consumptions and obstructions, agues",,,"Archer, John, fl. 1660-1684",,London,Printed by Peter Lillicrap for the author,1671,1671,,,,monographic,English,text,microfilm|||microform|||microfilm reel,"[4], 150 p.",,,Medicine|||Early works to 1800,,,,,,10066026,
9917938003406236,"country-man's companion, or, A new method of ordering horses & sheep so as to preserve them both from diseases and causalties [sic], or to recover them if fallen ill: and also to render them much more serviceable, The",,The country-man's companion|||The country man's companion|||A new method of ordering horses and sheep,"Tryon, Thomas, 1634-1703",,London,Printed and sold by Andrew Sowle ...,1688,1688,,,,monographic,English,text,microfilm|||microform|||microfilm reel,"[8], 173, [3] p.",,,Veterinary medicine|||Early works to 1800|||Horses|||Diseases|||Sheep,,,,,,14560811,
9935304803406236,"British jewel, or, Complete housewife's best companion: and, A choice variety of useful family recipes ... ; also, The complete farrier ... to which is added The royal gardener, or monthly calendar, The",,Complete housewife's companion|||Complete farrier|||Royal gardener,,,London,T. Sabine,177-?,177u,,,,monographic,English,text,print,136 p. : ill. ; 20 cm.,Early works to 1800,,"Cooking, British|||Medicine, Popular|||Self-care, Health|||Home economics|||Cooking|||Self Care|||Self Medication|||Economics",,,,,,ocm34163679,
9995048293406236,Chilam Balam of Ixil: facsimile and study of an unpublished Maya book,Chilam Balam de Ixil (Manuscript). English|||Chilam Balam de Ixil (Manuscript). Mayan,Facsimile and study of an unpublished Maya book|||Study of an unpublished Maya book,"Caso Barrera, Laura|||Aliphat, Mario","Caso Barrera, Laura (translator)|||Pope, Quentin (translator)",Mexico,Manuscript,17th century,2019,,2019,,monographic,English|||Mayan languages,text,print|||unmediated|||volume,"vi, 395 pages : illustrations (chiefly color), facsimiles ; 25 cm.",Early works|||Early works to 1800|||Facsimiles|||History|||Texts|||Translations|||Translations into Maya|||bibliography|||still image|||text,"""In Chilam Balam of Ixil Laura Caso Barrera translates for the first time a Yucatec Maya document that resulted from the meticulous reading by the Colonial Maya of various European texts such as the Bible and the Poem of the Mío Cid, as well as various studies on astronomy, astrology, calendars, and medicine. The Maya, showing considerable astuteness and insight, appropriated this knowledge. With this study and facsimile, experts can further their knowledge of Mayan calendars or traditional medicine; and Mayan enthusiasts can discover more about the culture's world view and history.""","Manuscripts, Maya|||Maya calendar|||Maya astronomy|||Mayas|||Medicine|||Traditional medicine|||Materia medica, Vegetable|||Religion|||Christian literature, Spanish|||Christianity and culture|||History|||Maya language|||Chilam Balam de Ixil (Manuscript)",,Yucatán (State)|||Mexico,,9789004353015|||9004353011,2018053530,on1078955336|||1078955336,
9917572013406236,"briefe, excellent, and profitable discourse, of the naturall beginning of all growing and liuing things, heate, generation, effects of the spirits, gouernment, vse and abuse of phisicke, preseruation, &c: no lesse pleasant and acceptable to the students of philosophie and phisicke, then beneficiall and necessarie for all others, desirous either of knowledge, health, youth, and long life : collected and tradused as wel forth of the best olde wryters, as out of the new, and most approued in our daies : in the ende wherof is shewed, the order and composition of a most heauenly water, for the preseruation of mans lyfe, A",,"Discourse of the naturall beginning of grovving and liuing things, &c","Jones, John, fl. 1562-1579",,London,"By William Iones, dvvelling in Paules Churchyard at the southvvest doore of Paules, and are ther to be sold",1574,1982,,,,monographic,English,text,microfilm|||microform|||microfilm reel,[54] p. : ill.,,,Medicine|||Early works to 1800,,,,,,22091454,
9918872503406236,Incipit liber Phisionomiæ,Physiognomia,Physiognomia|||Phisionomiæ|||Prima pars libri huius Ca. i,"Scot, Michael, approximately 1175-approximately 1234",,Venice,s.n.,1485,1485,,,,monographic,Latin,text,microform|||microopaque,[48] leaves ; (4to),,,"Medicine, Medieval|||Physiognomy|||Dentistry|||Early works to 1800|||Astrology",,,,,,08810815,
9918872483406236,Ortus sanitatis,Hortus sanitatis,Hortus sanitatis [maior],,,Mainz,J. Meydenbach,1491,1491,,,,monographic,Latin,text,microform|||microopaque,[453] leaves : ill. ; (fol.),Pre-Linnean works,,"Materia medica|||Early works to 1800|||Medicine, Medieval|||Botany, Medical|||Botany",,,,,,08810777,
9935313663406236,Johannis Herculani expositio in primam fen quarti canonis Avicenne,Expositio in primam fen quarti Canonis Avicennae De febribus,Expositio in primam Fen quarti canonis Avicennae,"Arcolani, Giovanni, -1484","Locatelli, Boneto, fl. 1480-1523 (printer)",Venice,"Mandato [et symbol] expe[n]sis nobilis viri Domini Octaviani Scoti civis Modoetiensis [per symbol] Bonetu[m] Locatellu[m] Bergomensez|||Scotto, Octaviano, fl. 1480-1499",1496,1496,,,,monographic,Latin,text,print,148 p. ; 31 cm.,,,"Medicine|||Early works to 1800|||History|||Human anatomy|||Anatomy|||History, 15th Century",15th century,,,,,34949077,
9918851273406236,Speculum lapidum clarissimi artium et medicine,,,"Leonardi, Camillo, fl. 1502",,Venice,[s. n.],1502,,,,,monographic,Latin,text,microform|||microopaque,LXVI leaves ; 21 cm.,,,Medicine|||Early works to 1800|||Materia medica|||Precious stones|||Gems,,,,,,08205334,
9935319563406236,Practica Joannis Arculani,,,"Arcolani, Giovanni, -1484","Rāzī, Abū Bakr Muḥammad ibn Zakarīyā, 865?-925?",Venice,"Expensis Andrre Torresani, per Bernardinum Vercellensem",1504,,,,,monographic,Latin,text,print,179 l. ; 31 cm.,,,"Medicine|||Early works to 1800|||History|||History, 16th Century",16th century,,,,,14307896,
9918856703406236,[De medica materia],,,"Dioscorides Pedanius, of Anazarbos",,Argent-sur-Sauldre,Apud Ioannem Schottum,1529,,,,,monographic,Modern Greek|||Latin,text,microform|||microopaque,[372] leaves.,,,"Materia medica|||Early works to 1800|||Medicine, Greek and Roman",,,,,,08321457,
9918870993406236,Marbodei De lapidibus pretiosis enchiridion: cum scholijs pictoris villingensis : eivsdem pictorii de lapide molari carmen,,De lapidibus,"Marbode, Bishop of Rennes, fl. 1067-1101",,unknown,s.n.],1531,,,,,monographic,Latin,text,microform|||microopaque,55 leaves,,,"Precious stones|||Therapeutic use|||Early works to 1800|||Medicine, Magic, mystic, and spagiric",,,,,,08744937,
9935303943406236,"Compendium siue (ut vulgo inscribitur): collectorium artis medicae, tam practicae quàm speculatiue",,Collectorium artis medicae|||Nusquam antea impressum Collectorium totius fere medicina,"Bertucci, Niccolò, -1347","Caesarius, Johannes, 1468?-1550?",Cologne,Apud Melchiorem Nouesianum,1537,,,,,monographic,Latin,text,print,"[7], cclxvi p. ; 21 cm.",,,"Medicine|||History|||Medicine, Medieval|||Early works to 1800|||History, 16th Century|||History, Medieval",16th century,,,,,29163558,
9935322873406236,"[Hippokratous Kōou iatrou palaiotatou, pantōn allōn koryphaiou, biblia hapanta] =: Hippocratis Coi medici uetustissimi, et omnium aliorum principis, libri omnes, ad uetustos codices summo studio collati & restaurati",Works. Greek. 1538,Hippocratis Coi medici,Hippocrates.,"Cornarius, Janus, 1500-1558|||Episcopius, Nicolaus, 1501-1564 (printer)|||Froben, Hieronymus, 1501-1563 (printer)",Basel,Froben,1538,,,,,monographic,Ancient Greek,text,print,"[8], 562, [2] p. ; fol.",Early works to 1800,,Medicine,,"Switzerland, Basel",,,,ocm43131426,
9918852323406236,"Hieronymi Fracastorii Homocentrica, eivsdem, De cavsis criticorvm diervm per ea qvæ in nobis svnt",,"Homocentrica|||De cavsis criticorvm diervm per ea qvæ in nobis svnt|||Homocentrica, sive, De stellis|||De stellis","Fracastoro, Girolamo, 1483-1553",,Venice,[s.n.],1538,,,,,monographic,Latin,text,microform.|||microform|||microopaque,"[3], 73 [i.e. 78] leaves : ill. ; 22 cm.",,,Astronomy|||Early works to 1800|||Crises and critical days (Pathology)|||Medicine|||Astrology|||Planets,,,,,,08225178,
9918862833406236,Macri De materia medica lib. V,,De materia medica lib. V,"Macer, Floridus, fl. active 12th century","Comarius, Janus, 1500-1558",Frankfurt,Chr. Ege[nolphus],1540,,,,,monographic,Latin,text,microform|||microopaque,"[12], 132 leaves ; 16 cm.",,,Materia medica|||Early works to 1800|||Medicine,,,,,,08456944,
9935322013406236,"dissection des parties du corps humain diuisee en trois liures, La",De dissectione partium corporis humain libri tres. French,,"Estienne, Charles, 1504-approximately 1564","La Rivière, Estienne de.|||Jollat.|||Tory, Geoffroy, approximately 1480-approximately 1533",Paris,S. de Colines,1546,,,,,monographic,French|||Latin,text,print,405 p. : ill. ; 37 cm.,,,"Human dissection|||Early works to 1800|||Human anatomy|||History|||Medicine|||Dissection|||Anatomy|||History, 16th Century",16th century,,,,78391165 //r864,04591369,
9935319573406236,"Aetii, medici graeci: contractae ex veteribvs medicinae Tetrabiblos, hoc est qvaternio, id est libri uniuersales quatuor, singuli quatuor sermones complectentes, ut sint in summa quatuor sermonum quaterniones, id est sermones XVI",Tetrabiblos. Selections. Latin. 1549,,"Aetius, of Amida, 502-575","Cornarius, Janus, 1500-1558",Basel,apvd Hier. Froben. et Nic. Episcopivm.,1549,,,,,monographic,Ancient Greek|||Latin,text,print,"916, [54] p. ; 33 cm.",,,"Medicine, Greek and Roman|||Medicine|||Early works to 1800|||History|||History, Ancient|||History, 16th Century|||History of Medicine",16th century,,,,,09334029,
9918851033406236,"Leonharti Fvchsii Methodvs sev ratio compendiaria perueniendi ad culmen medicinæ: nunc denuo omni cura recognita : eiusdem de vsitata huius temporis componemdorem, miscendorum[que] medicamentorum ratione, libri tres : indice duplici, Latino & Græce copiosissimo, adiecte",,Methodvs sev ratio compendiaria perueniendi ad culmen medicinæ,"Fuchs, Leonhart, 1501-1566",,Lyon,Apud Gulielmum Rouillium,1550,,,,,monographic,Ancient Greek|||Latin,text,microform|||microopaque,"[16], 533, [54] p. ; 13 cm.",,,"Medicine|||Early works to 1800|||Formulae, receipts, prescriptions",,,,,,08202782,
9934978303406236,"Benedicti Victorii Fauentini philosophi, ac medici excellentissimi, theoricam medicinæ in doctissimo Bononiensi Gymnasio edocentis, In Hippocratis Prognostica commentarii: His accessit Theoricae latitudinum medicinae liber, ad Galeni scopum in arte medicinali",,"Benedicti Victorii Faventini philosophi, ac medici excellentissimi, theoricam medicinæ in doctissimo Bononiensi Gymnasio edocentis, In Hippocratis Prognostica commentarii|||In Hippocratis Prognostica commentarii. His accessit Theoricae latitudinum medicinae liber, ad Galeni scopum in arte medicinali","Vittori, Benedetto, d. 1561","Laurentianus, Laurentius, ca. 1450-1502 (translator)|||Torrentino, Lorenzo, d. 1563 (printer)",Florence,Apud Laurentium Torrentinum ducalem typographum,1551,,,,,monographic,Latin,text,print,"243, [17] p. ; 32 cm.",Early works to 1800,,Medicine|||Galen,,"Italy, Florence",,,,ocm43655100,
9918852413406236,"Petri Andreae Matthioli Commentarii, in libros sex Pedacii Dioscoridis Anazarbei, De medica materia: adiectis quàm plurimis plantarum & animalium imaginibus, eodem authore",Commentarii a Dioscoride. Latin,"Commentarii, in libros sex Pedacii Dioscoridis Anazarbei, De medica materia","Mattioli, Pietro Andrea, 1501-1577",,Venice,"In Officina Erasmiana, apud Vincentium Valgrisium",1554,,,,,monographic,Italian|||Latin,text,microform|||microopaque,"[48], 707 p. : ill. ; 31 cm.",,,"Medicine, Greek and Roman|||Early works to 1800|||Materia medica|||of Anazarbos Dioscorides Pedanius|||De medica materia",,,,,,08230496,
9918852333406236,"Hieronymi Fracastorii Veronensis Opera omnia: in vnum proxime post illius mortem collecta, quorum nomina sequens pagina plenius indicat : accesservnt Andreae Navgerii, patricii Veneti, Orationes duae carminaq. nonnulla, amicorum cura ob id nuper simul impressa, ut eorum scripta, qui arcta inter se uiuentes necessitudine coniuncti fuerunt, in hominum quoque manus post eorum mortem iuncta pariter peruenirent cum illustriss",,Opera omnia|||Orationes duae carminaq,"Fracastoro, Girolamo, 1483-1553","Navagero, Andrea, 1483-1529",Venice,Apvd Ivntas,1555,,,,,monographic,Latin,text,microform|||microopaque,"[6], 285 [i.e. 281], 32 leaves : ill., ports. ; 23 cm.",,,Medicine|||Early works to 1800|||Astronomy,,,,,,08225234,
9940550733406236,De sanitate tuenda libri sex,De sanitate tuenda. Latin,,Galen.,"Linacre, Thomas, 1460-1524",Lyon,Apud Guliel. Rovil.,1559,,,,,monographic,Greek|||Ancient (to 1453)|||Latin,text,print,"375, [39] p. ; 13 cm.",,,"Medicine, Greek and Roman|||Hygiene|||Early works to 1800|||Medicine, Ancient",,,,,,ocm14315845,
9917591163406236,"This is the myrrour or glasse of helth: necessary and nedefull for euery person to loke in that wil kepe their bodye from the syckenesse of the pestilence : and it sheweth how the planettes do raygne in euery houre of the daye and nyghte, with the natures and exposicio[n]s of the xii sygnes deuyded by the xii monethes of the yeare : and shewed the remedies for many dyers infirmities and dyseases that hurteth the bodye of manne",,,"Moulton, Thomas, fl. 1540?",,unknown,T. Colwell,1561?,1561,,,,monographic,English,text,microfilm|||microform|||microfilm reel,[120] p.,,,Medicine|||Early works to 1800|||Medical astrology,,,,,,23893764,
9935310733406236,"Cl. Galeni Pergameni omnia, quae extant, in Latinum sermonem conuersa: quibus post summan antea adhibitam didgentiam, multum nunc quo[que] splen-doris accessit, quód loca quámplurima ex emendatorum exemplarium collatione & illustrata fuerint & castigata : his accedunt nunc primum Con. Gesneri praefatio & prolegomena tripartitia, de vita Galeni, eius[q́ue] libris & interpretibus",Works. Latin. 1561,"Omnia, quae extant, in Latinum sermonem conuersa|||Omnia, qvae extant, in Latinvm sermonem conversa",Galen.,"Gessner, Conrad, 1516-1565|||Gratarolo, Guglielmo, 1516?-1568?|||J. G. S. (Joannes Guicaeus Stratander).",Basel,"Ex III, officin. Frobenianae editione.",1561-1562,1561/1562,,,,monographic,Ancient Greek|||Latin,text,print,11 v. : ill. ; 38 cm.,bibliography|||biography,,"Medicine, Greek and Roman|||Medicine, Ancient|||Medicine|||Early works to 1800|||History|||History, Ancient|||History, 16th Century|||History of Medicine",16th century,,,,,23637257,
9934978413406236,Spittal Bůch,,,"Paracelsus, 1493-1541","Bodenstein, Adam von, 1528-1577",Mulhouse,"Peter Schmid,",1562,1562,,,,monographic,German,text,print|||unmediated|||volume,[83] p. ; 18 cm.,Early works to 1800|||text,,Medicine,,,,,,ocm14318954,http://nbn-resolving.de/urn/resolver.pl?urn=urn:nbn:de:bvb:12-bsb00086380-1
9940547383406236,Bartholomaei Eustachii Sanctoseverinatis medici ac philosophi Opuscula anatomica: quorum numerum & argumenta aversa pagina indicabit,Opuscula anatomica,"Bartholomaei Evstachii Sanctoseverinatis medici ac philosophi Opvscvla anatomica|||Opuscula anatomica|||Opvscvla anatomica|||Bartholomaei Eustachii Sanctoseuerinatis Libellus de dentibus|||Libellus de dentibus|||Annotationes horum opusculorum ex Hippocrate, Aristotele, Galeno, aliisque authoribus collectae","Eustachi, Bartolomeo, d. 1574","Pini, Pietro Matteo, b. ca. 1540|||Luchino, Vincenzo, fl. 1550-1566 (printer)",Venice,Vicentius Luchinus excudebat,1563,,,,,monographic,Latin,text,print,"[10], 323, 8 p. of plates, [9], 95, [199] p. : ill. ; 21 cm.",Early works to 1800,,Medicine|||Human anatomy|||Ear|||Anatomy|||Eustachian tube|||Heart|||Valves|||Kidneys|||Thoracic duct|||Early works to 1800|||Veins|||Teeth,,"Italy, Venice",,,,,
9935322003406236,Opera quae extant omnia,,,Hippocrates.,"Cornarius, Janus, 1500-1558|||Culmann, Johann, fl. 1554|||Petreius, Nicolas, 1500-1568",Lyon,Apud haeredes Jacobi Junctae,1567,,,,,monographic,Latin,text,print,588 p. ; 34 cm.,,,"Medicine|||Early works to 1800|||History|||History, 16th Century",,,,,,14294900,
9918835853406236,"Commentaires de M. P. André Matthiolus, medecin senois, sur les six livres de Pedacius Dioscoride, Anazarbeen De la matiere medicinale","Commentarii, in libros sex Pedacii Dioscoridis Anazarbei, De medica materia. French",,"Mattioli, Pietro Andrea, 1501-1577","Du Pinet, Antoine, sieur de Noroy, 1515?-1584?",Lyon,par la veuve de feu Gabriel Cotier,1572,,,,,monographic,French|||Latin,text,microform|||microopaque,"[134], 606, [32] p. : ill. ; 34 cm.",,,"Medicine, Greek and Roman|||Early works to 1800|||Materia medica|||of Anazarbos Dioscorides Pedanius|||De medica materia",,,,,,04069393,
9918872703406236,"Commentaires de M. P. André Matthiolus, medecin senois, sur les six livres de Pedacius Dioscoride, Anazarbeen De la matiere medicinale","Commentarii, in libros sex Pedacii Dioscoridis Anazarbei, De medica materia. French",,"Mattioli, Pietro Andrea, 1501-1577","Du Pinet, Antoine, sieur de Noroy, 1515?-1584?",Lyon,par la veuve de feu Gabriel Cotier,1572,,,,,monographic,French|||Latin,text,microform|||microopaque,"[134], 606, [32] p. : ill. ; 34 cm.",,,"Medicine, Greek and Roman|||Early works to 1800|||Materia medica|||of Anazarbos Dioscorides Pedanius|||De medica materia",,,,,,10359269,
9917577423406236,"treasurie of commodious conceits, & hidden secrets, and may be called, The huswiues closet, of healthfull prouision: mete and necessarie for the profitable vse of all estates both men and women, and also pleasaunt for recreation : with a necessary table of all things herein contayned : gathered out of sundrye experiments lately practised by men of great knowledge, The",,"Huswiues closet, of healthfull prouision","Partridge, John, active 1566-1573",,London,By Richarde Iones,1573,,,,,monographic,English,text,microfilm|||microform|||microfilm reel,"[94] p., [1] leaf of plates : ill.",Early works to 1800,,"Cooking, English|||Medicine, Popular|||Early works to 1800",,,,,,22470062,
9934863473406236,"Constantii Varolii medici Bononiensis: De nervis opticis, nonnullisq; aliis praeter communem opinionem in humano capite observatis",,De nervis opticis,"Varoli, Costanzo, 1543-1575",,Padua,"apud Paulum et Aantonium Meisttos fratres,",1573,1969,,,,monographic,Latin,text,print|||unmediated|||volume,"18 unnumbered pages, 32 pages, 2 unnumbered pages : illustrations ; 18 cm",Early works to 1800|||text,,Optic Nerve|||Medicine,,,,,73348589,ocm01994672,
