id,title,uniform_title,alternative_title,creator,contributor,publication_place,publisher,publication_date,encoded_date,creation_date,copyright_date,edition,issuance,language,type_of_resource,format,extent,genre,abstract,subject,temporal_coverage,geographic_coverage,target_audience,isbn,lccn,oclccn,url
9917604343406236,"Enchiridion medicum theoretico-practicum, sive, Tractatus de morborum theoria & praxi cui subnectitur appendix de lue venera: in quo omnium morborum humano generi officientium, nomina, naturæ, causæ, signa, & prognostica, unâ cum eorundem curatione breviter & perspicue delineantur",,Tractatus de morborum theoria & praxi cui subnectitur appendix de lue venera,"Jackson, Joseph, active 1695-",,London,Excudebat T. Sowle,1695,,,,,monographic,Latin,text,microfilm|||microform|||microfilm reel,"[22], 246 p.",,,Medicine|||Early works to 1800|||Syphilis,,,,,nuc87556882,08164118,
9917623633406236,"Dr Sydenham's practice of physick: the signs, symptoms, causes, and cures of diseases : with many additions from the second edition of the Latin copy, his discourses of consumptions, gouts &c. never before publish'd",,The practice of physick,"Sydenham, Thomas, 1624-1689","Salmon, William, 1644-1713",London,Printed for Sam. Smith and Benj. Walford and J. Knapton,1695,,,,,monographic,English|||Latin,text,microfilm|||microform|||microfilm reel,"[10], 192 p.",,,Medicine|||Early works to 1800|||Therapeutics,,,,,,09407267,
9917630773406236,Processus integri in morbis ferè omnibus curandis,,,"Sydenham, Thomas, 1624-1689",,London,Impensis Sam. Smith & Benj. Walford & J. Knapton,1695,,,,,monographic,Latin,text,microfilm|||microform|||microfilm reel,"[8], 108 p.",,,Medicine|||Early works to 1800,,,,,,09594107,
9917791973406236,"Some farther considerations concerning alkaly and acid, by way of appendix to a late essay: wherein the terms are made clear, and the natures of them more fully explained : together with an answer to the objections that have been raised against some things contained in the said essay",,,"Colbatch, John, Sir, 1670-1728",,London,Printed for Fr. Mills and W. Turner ...,1696,,,,,monographic,English,text,microfilm|||microform|||microfilm reel,"[12], 100 p.",,,"Medicine|||Early works to 1800|||Formulae, receipts, prescriptions|||Sir Colbatch, John 1670-1728|||Physico medical essay, concerning alkaly and acid",,,,,,12388696,
9917795243406236,"family physitian, or, A collection of choice, approv'd and experienc'd remedies: for the cure of almost all deseases incident to humane bodies, whether internal or external, useful in families, and very serviceable to country people : containing some hundreds of considerable receipts and secrets of great value, with observations of great cures : together with the true English wine-celler, and the right method of making the English-wines, or metheglin : with a collection of the choicest and safest cosmetick remedies for preserving the beauty and complection of ladies, never before publish'd, The",,"The family physitian|||A collection of choice, approv'd and experienc'd remedies","Hartman, G. (George)",,London,Printed for Richard Wellington ...,1696,,,,,monographic,English,text,microfilm|||microform|||microfilm reel,"[20], 528 p.",,,"Medicine|||Early works to 1800|||Wine and wine making|||Beauty, Personal",,England,,,,12400476,
9917804283406236,"Ars curandi morbos expectatione: item De vanitatibus, dolis, & mendaciis medicorum : accedunt his præcipuè supposita, & phænomena, quibus veterum recentiorumque dogmata de febribus, tussi, phthisi, asthmate, apoplexia, calculo renum & vesicæ, ischuria, & passione hysterica convelluntur, aliaq, verisimiliora traduntur",,"De vanitatibus, dolis, & mendaciis medicorum","Harvey, Gideon, 1640?-1700?",,London,Impensis Guil. Freeman ...,1696,,,,,monographic,Latin,text,microfilm|||microform|||microfilm reel,"[8], 350, [1] p.",,,Medicine|||Early works to 1800|||Physicians|||Psychology,,,,,,12482584,
9917853003406236,"Medicinal experiments, or, A collection of choice and safe remedies for the most part simple and easily prepared: very useful in families and fitted for the service of country people : the first and second volumes, containing about four hundred choice receipts",,Medicinal experiments|||A collection of choice and safe remedies for the most part simple and easily prepared,"Boyle, Robert, 1627-1691",,London,Printed for Samuel Smith and B. Walford,1696,,,,The third edition.,monographic,English,text,microfilm|||microform|||microfilm reel,"2 v. in 1 ([24], 154 p.)",,,"Medicine|||Early works to 1800|||Formulae, receipts, prescriptions",,,,,,12774069,
9917937003406236,"family-dictionary, or, Houshold [sic] companion: containing, in an alphabetical method, I. Directions for cookery ... VII. The preparations of several choice medicines, The",,The family dictionary|||Household companion,"Salmon, William, 1644-1713",,London,Printed for H. Rhodes ...,1696,,,,"The second edition, corrected and much enlarged.",monographic,English,text,microfilm|||microform|||microfilm reel,"[8], 393 p.",Early works to 1800|||dictionary,,"Cooking, English|||Cooking|||Medicine, Popular|||Early works to 1800",,England,,,,14514958,
9917939693406236,"letter to his worthy friend, D.B.M. from Dr. Connor, member of the College of Physicians and  Royal Society, A",,,"Connor, Bernard, 1666?-1698",,London,Printed for Sam. Briscoe ...,1696,,,,,monographic,English,text,microfilm|||microform|||microfilm reel,1 sheet (2 p.),,,Medicine|||Early works to 1800|||Miracles,,,,,,14871551,
9917948243406236,"preternatural state of animal humours: described by their sensible qualities, which depend on the different degrees of their fermentation and the cure of each particular cacochymia is performed by medicines of a peculiar specific taste, described : to this treatise are added two appendixes I. About the nature of fevers and their ferments and cure by particular tastes, II. Concerning the effervescence and ebullition of the several cacochymia's, The",,,"Floyer, John, Sir, 1649-1734",,London,"Printed by W. Downing for Michael Johnson and are to be sold by Robert Clavel, Sam. Smith and Benjamin Walford ...",1696,,,,,monographic,English,text,microfilm|||microform|||microfilm reel,"[23], 264 p.",,,Medicine|||Early works to 1800|||Body fluids,,,,,,15538920,
9917994013406236,"Modest examination of a late pamphlet entituled, Apollo mathematicus, A",,,,,Edinburgh,s.n.,1696,,,,,monographic,English,text,microfilm|||microform|||microfilm reel,"[4], 31, [4] p.",,,"Medicine|||Anecdotes|||Pitcairn, Archibald 1652-1713|||Sir Eizat, Edward|||Apollo mathematicus, or, The art of curing diseases by the mathematicks according to the principles of Dr. Pitcairn",Early works to 1800,,,,,18776867,
9917621143406236,"physico medical essay concerning alkaly and acid: so far as they have relation to the cause or cure of distempers : wherein is endeavoured to be proved that acids are not (as is generally and erroneously supposed) the cause of all or most distempers, but that alkalies are : together with an account of some distempers and the medicines with their preparations proper to be used in the cure of them : as also a short digression concerning specifick remedies, A",,,"Colbatch, John, Sir, 1670-1728",,London,Printed for Dan. Browne,1696,,,,,monographic,English,text,microfilm|||microform|||microfilm reel,"[27], 147, [1] p.",,,"Medicine|||Early works to 1800|||Formulae, receipts, prescriptions|||Diseases|||Causes and theories of causation",,,,,,09318111,
9917622753406236,"Queens closet opened: being incomparable secrets in physick, chyrurgery, preserving, and candying &c. which were presented to the Queen, The",,The compleat cook|||The Queen's cabinet opened|||A Queen's delight,,,London,Printed by E. Blagrave and are to be sold by the booksellers of London and Westminster,1696,,,,"The tenth edition, corrected with many new and large additions",monographic,English,text,microfilm|||microform|||microfilm reel,"[6], 401, [8] p.",Early works to 1800,,"Formulas, recipes, etc|||Medicine, Popular|||Cooking",,,,,,09382610,
9917645653406236,"Praxeos Mayernianæ: ex adversariis, consiliis ac epistolis ejus summâ curâ ac diligentiâ concinnatum : syntagma alterum",,,"Mayerne, Théodore Turquet de, Sir, 1573-1655",,London,Impensis Sam. Smith & Benj. Wolford,1696,,,,,monographic,Latin,text,microfilm|||microform|||microfilm reel,"[7], 283, [5] p., [1] leaf of plates : port.",,,"Medicine|||Early works to 1800|||Formulae, receipts, prescriptions",,,,,,10590547,
9917817263406236,"plain introduction to the art of physick: containing the fundamentals, and necessary preliminaries to practice ... : to which is added, The materia medica contracted, and alphabetical tables of the vertues of roots, barks, woods, herbs, flowers, seeds, fruits, juices and gums ... : also a collection of choice medicines chymical and Galenical, together with a different way of making the most celebrated compositions in the apothecaries shops, A",,Materia medica contracted,"Pechey, John, 1655-1716","Ettmüller, Michael, 1644-1683|||Marggraf, Christiaan, 1626-1687",London,Printed for Henry Bonwicke ...,1697,,,,,monographic,English,text,microfilm|||microform|||microfilm reel,"[17], 390, [2] p.",,,Medicine|||Early works to 1800|||Materia medica,,,,,,12576170,
9917825373406236,"Martini Lister octo exercitationes medincinales: quarum I. De hydrope, II. De diabete, III. De hydrophobia, IV. De lue venerea, V. De scorbuto, VI. De arthritide, VII. De calculo humano, VIII. De variolis",Octo exercitationes medicinales,,"Lister, Martin, 1638?-1712",,London,Apud Sam. Smith & Benj. Walford ...,1697,,,,"Altera editio ab auctore recognita, & non parum aucta.",monographic,Latin,text,microfilm|||microform|||microfilm reel,"[2], 348 p.",,,Medicine|||Early works to 1800,,,,,,12616942,
9917839243406236,Exercitationes quinque,,,"Leigh, Charles, 1662-1701?",,Oxford,"Typis L. Lichfield, impensis T. Bennet ...",1697,,,,,monographic,Latin,text,microfilm|||microform|||microfilm reel,"[17], 156 p.",,,Medicine|||Early works to 1800,,,,,,12691801,
9917874113406236,"Marcelli Malpighii, philosophi & medici bononiensis e Regia Societate Lond. Opera posthuma: figuris æneis illustrata : quibus præfixa est ejusdem vita seipso scripta",Selections. 1697,Opera posthuma|||De structurâ glandularum,"Malpighi, Marcello, 1628-1694",,London,Impensis A. & J. Churchill,1697,,,,,monographic,Latin,text,microfilm|||microform|||microfilm reel,"[5], 110, [2], 187, [1] p., 19 leaves of plates : ill., port.",,,Medicine|||Glands|||Early works to 1800,,,,,,12951622,
9917896903406236,"husbandman, farmer and grasier's compleat instructor: containing choice and approved rules, and directions for breeding, feeding, chusing, buying, selling, well ordering and fatning bulls, cows, calves, rams, ews, lambs, swine, goats, asses, mules, &c. : how to know the several diseases incident to them, by their signs and symptoms, with proper remedies to cure them : as likewise all griefs, and sorrances what-ever : also, a treatise of dogs, and conies, in their breeding, ordering, and curing the distempers they are subject to, how to breed, feed and fatten poultry, and cure their several diseases : to which is added, The experienced vermine-killer, in particular directions, for taking and destroying all sorts of vermine in houses, out-houses, fields, garden, graneries, and other places, The",,The experienced vermine killer,"A. S., Gent",,London,Printed for Henry Nelme ...,1697,,,,,monographic,English,text,microfilm|||microform|||microfilm reel,"[4], 168 p., 1 leaf of folded plates.",,,Breeding|||Early works to 1800|||Domestic animals|||Animal industry|||Veterinary medicine,,,,,,13173439,
9915255373406236,"Abyssinian philosophy confuted, or, Telluris Theoria neither sacred, nor agreeable to reason: being, for the most part, a translation of Petrus Ramazzini, Of the wonderful springs of Modena : illustrated with many curious remarks and experiments by the author and translator : to which is added, a new hypothesis deduced from scripture, and the observation of nature : with the addition of some miscellany experiments / by Robert St. Clair, The",De fontium Mutinensium admiranda scaturigine tractatus physico-hydrostaticus. English,,"Ramazzini, Bernardino, 1633-1714","St. Clair, Robert.|||Ramazzini, Bernardino, 1633-1714",London,"printed for the author, and sold by W. Newton ...",1697,,,,,monographic,English|||Latin,text,print,207 p. : ill.,,,Springs|||Religious aspects|||Fountains|||Groundwater|||Science|||Philosophy|||Health resorts|||Medicine|||Early works to 1800,,Modena|||Italy,,,,32473599,
9917944903406236,"physical dictionary: wherein the terms of anatomy, the names and causes of diseases, chyrurgical instruments and their use, are accurately described : also the names and virtues of medicinal plants ... etc. ... the various forms of medicines and the ways of compounding them, The",,,"Blankaart, Steven, 1650-1702",,London,Printed for S. Crouch,1697,,,,"The third addition,",monographic,English,text,microfilm|||microform|||microfilm reel,"[3], 212 p.",dictionary,,Medicine|||Dictionaries|||Early works to 1800,,,,,,15260990,
9917965763406236,"Arcana philosophia, or, Chymical secrets: containing the noted and useful chymical medicines of Dr. Wil. and Rich. Russel chymists, viz. I. Species vitæ, alias universalis, II. Tinctura regalis, call'd scorbutick, &c., III. Species coroborativa, alias pleuretica, IV. Species proprietatis, V. Species minor, VI. A pestilential cordial, call'd his white cordial : as also several curious chymical processes and spagerick preparations of natural things for the use of medicin, and many other things of great use and vertue in eradicating the most stubborn diseases, likewise four curious small treatises, viz. the I. Of fevers, the II. Of the jaundies, the III. Of madness, and the IV. Of diarrhæas, lientries &c., by the renowned and most aproved Dr. Aurelius Philipus Theophrastus Paracelsus, of Hoheneim",,Arcana philosophia|||Chymical secrets,"Headrich, John.","Russel, Richard.|||Russell, William, 1634-1696?",London,"Printed and sold by Henry Hills ... the publisher ... and the booksellers of London, &c.",1697,,,,,monographic,English,text,microfilm|||microform|||microfilm reel,"[16], 128, [7] p.",,,"Medicine|||Formulae, receipts, prescriptions|||Early works to 1800|||Pharmacy",,,,,,16949220,
9917603593406236,"art of preserving and restoring health: explaining the nature and causes of the distempers that afflict mankind : also shewing that every man is, or may be his own best physician : to which is added a treatise of the most simple and effectual remedies for the diseases of men and women, The",,,"Flamant, M, fl. 1692-1699",,London,"Printed by R. Bently, H. Bonwick, and S. Manship",1697,,,,,monographic,English|||Latin,text,microfilm|||microform,"[18], 110, [7] p.",,,Medicine|||Early works to 1800|||Health,,,,,,08121975,
9917654863406236,"Evangelium medici, seu, Medicina mystica: de suspensis naturæ legibus, sive, de miraculis",,Evangelium medici|||Medicina mystica,"Connor, Bernard, 1666?-1698",,London,"Sumptibus bibliopolarum Richardi Wellington, Henrici Nelme, & Samuelis Briscoe",1697,,,,,monographic,Latin,text,microfilm|||microform|||microfilm reel,271 p. in various paginations.,,,Physiology|||Early works to 1800|||Medicine|||Religious aspects,,,,,,11076565,
9917791983406236,"relation of a very sudden and extraordinary cure of a person bitten by a viper, by the means of acids: together with some remarks upon Dr. Tuthill's vindication of his objections against the doctrine of acids : wherein are contained several things in order to the further clearing of the said doctrine, A",,,"Colbatch, John, Sir, 1670-1728",,London,"Printed for Dan. Brown ..., Abel Roper ..., and Tho. Leigh ...",1698,,,,,monographic,English,text,microfilm|||microform|||microfilm reel,"[12], 116 p.",,,"Medicine|||Early works to 1800|||Tuthill, Francis|||Vindication of some objections lately raised against Dr. J. Colbatch his hypothesis",,,,,,12388703,
9917805483406236,"rebuke to the authors of a blew-book call'd, The state of physick in London: which is indeed the black and blew state of physick, dated from the college, and signed by Th. G. and R.M, A",,,"Salmon, William, 1644-1713",,London,Printed and sold by E. Whitlock ...,1698,,,,,monographic,English,text,microfilm|||microform|||microfilm reel,32 p.,,,Medicine|||Early works to 1800|||Royal College of Physicians of London.|||State of physick in London,,London|||England,,,,12489966,
9939158823406236,"De urinis et pulsibus, De missione sanguinis, De febribus, De morbis capitis, et pectoris",,"De urinis et pulsibus|||De missione sanguinis|||De febribus|||De morbis capitis, et pectoris","Bellini, Lorenzo, 1643-1704","Redi, Francesco, 1626-1698|||Bohn, Johannes, 1640-1718",Frankfurt,"Sumptibus Johannis Grosii, viduae & haered|||Charactere Huchonis",1698,,,,Editio secunda priori correctior.,monographic,Latin,text,print,"[32], 688, [32] p. ; 21 cm.",Early works to 1800,,Medicine|||Bloodletting|||Fever|||Craniocerebral Trauma|||Pulse|||Thoracic Diseases|||Urine,,,,,,ocm11369314,
9917763633406236,"voyage to the East-Indies: giving an account of the Isles of Madagascar, and Mascareigne, of Suratte, the coast of Malabar, of Goa, Gameron, Ormus : as also A treatise of the distempers peculiar to the eastern countries : to which is annexed an abstract of Monsieur de Rennefort's History of the East-Indies, with his propositions for the improvement of the East-India Company, A",Relation d'un voyage des Indes orientales. English,A treatise of the distempers relating in particular to the eastern countries|||A treatise of the distempers peculiar to the eastern countries,"Dellon, Gabriel, 1649-","Crull, J. (Jodocus), d. 1713? (tr)|||Rennefort, Souchu de, ca. 1630-ca. 1690|||Dellon, Gabriel, b. 1649",London,"Printed for D. Browne ..., A. Roper ..., and T. Leigh ...",1698,,,,,monographic,English|||Latin,text,microfilm|||microform|||microfilm reel,"[30], 248, 43 p.",,,Tropical medicine|||Early works to 1800|||Voyages and travels|||Description and travel,,Indonesia,,,,12264527,
9917774453406236,"dialogue between alkali and acid: containing divers philosophical and medicinal considerations : wherein a late pretended new hypothesis asserting alkali the cause and acid the cure of all diseases, is proved groundless and dangerous : being a specimen of the immodest self-applause, shameful contempt, and abuse of all physicians, gross mistakes and great ignorance of the pretender John Colbatch, A",,,"Emes, Thomas, d. 1707",,London,Printed for R. Cumberland ... and Tho. Speed ...,1698,,,,,monographic,English,text,microfilm|||microform|||microfilm reel,"[4], 108 p.",,,Medicine|||Early works to 1800,,,,,,12297480,
9917782423406236,"Queens closet opened: being incomparable secrets in physick, chyrurgery, preserving, candying, and cookery, &c. which were presented to the Queen by the most experienc'd persons of the times, many whereof were had in esteem when she pleased to descend to private recreations, The",,A Queens delight|||The pearl of practice|||The compleat cook|||The Queen's cabinet opened,W. M.,,London,"Printed for J. Philips ..., H. Rhodes ..., J. Taylor ..., and K. Bently ...",1698,,,,"The tenth edition, corrected with many new and large additions, together with three exact tables.",monographic,English,text,microfilm|||microform|||microfilm reel,"[9], 401, [8] p. : port.",Early works to 1800,,"Cooking, English|||Medicine, Popular",,,,,,12346513,
9917783093406236,"plain and short treatise of an apoplexy, convulsions, colick, twisting of the guts, mother fits, bleeding at nose: and several other violent and dangerous diseases ... : shewing the sick or by-standers what ought presently to be done : together with proper remedies for each disease and plain directions for the use of them, A",,,"Pechey, John, 1655-1716",,London,Printed for the author and sold at his house ...,1698,,,,,monographic,English,text,microfilm|||microform|||microfilm reel,"[4], 29 p.",,,Medicine|||Early works to 1800,,,,,,12350463,
9917783163406236,"compleat midwife's practice enlarged in the most weighty and high concernments of the birth of man: containing a perfect directory or rules for midwives and nurses : as also a guide for women in their conception, bearing and nursing of children from the experience of our English authors, viz., Sir Theodore Mayern, Dr. Chamberlain, Mr. Nich. Culpeper ... : with instructions of the Queen of France's midwife to her daughter, The",,Rare secrets brought to light,"Pechey, John, 1655-1716","Chamberlen, Hugh.|||Culpeper, Nicholas, 1616-1654|||Boursier, Louise Bourgeois, approximately 1563-1636|||Mayerne, Théodore Turquet de, Sir, 1573-1655",London,Printed for H. Rhodes ... J. Philips ... J. Taylor ... and K. Bentley ...,1698,,,,"The fifth edition corrected, and much enlarged.",monographic,English,text,microfilm|||microform|||microfilm reel,"[16], 352 p., [5] leaves of plates : ill., port.",,,Obstetrics|||Early works to 1800|||Medicine,,England,,,,12350631,
9917949233406236,"examination of Mr. John Colbatch his books: viz. I. Novum lumen chirurgicum, II. Essay of alkalies and acids, III. An appendix to that essay, IV. A treatise of the gout, V. The doctrin of acids further asserted &c. VI. A relation of a person bitten by a viper &c. : to which is added an answer to Dr. Leigh's remarks on a treatise concerning, the heat of the blood : together with remarks on Dr. Leigh's book intituled Exercitationes quinq. ... : as also a short view of Dr. Leigh's reply to Mr. Colbatch &c, An",,,"Boulton, Richard, b. 1676 or 7",,London,Printed for A. and J. Churchill ...,1698,,,,,monographic,English,text,microfilm|||microform|||microfilm reel,"[18], 291, [1] p.",,,"Medicine|||Early works to 1800|||Sir Colbatch, John 1670-1728|||Leigh, Charles 1662-1701?",,,,,,15560595,
9917608133406236,Four treatises of physick and chirurgery,,,"Colbatch, John, Sir, 1670-1728",,London,Printed by J.D. for Daniel Brown,1698,,,,"The second edition, corrected and enlarged.",monographic,English,text,microfilm|||microform,"xxiii, 122, 86 p.",,,Medicine|||Early works to 1800|||Surgery,,,,,,08483922,
9917635223406236,De tuto cantharidum in medicina usu interno,,,"Groeneveld, Joannes, 1647-1710?",,London,Typis J.H. prostant venales apud Johannem Taylor,1698,,,,,monographic,Latin,text,microfilm|||microform|||microfilm reel,"[1], xvi, 135, [1] p.",,,Medicine|||Early works to 1800|||Cantharides,,,,,,09825963,
9917819233406236,"dispensary: a poem, in six cantos, The",,,"Garth, Samuel, Sir, 1661-1719",Royal College of Physicians of London,London,Printed and sold by John Nutt ...,1699,,,,"The second edition, corrected by the author.",monographic,English,text,microfilm|||microform|||microfilm reel,"[22], 94 p.",,,Medicine|||Anecdotes|||Early works to 1800|||Poetry,,,,,,12581579,
9917822923406236,"essay concerning nutrition in animals: proving it analogical to that of plants, and discovering the like structure and use of the organs to be alike in both, with many observations towards the practise of physick : together with a short discourse upon the nature of the soul in plants, animals, and man, An",,,"Guide, Philippe, d. 1718",,London,"Printed for the author, and are to be sold by H. Rhodes ...",1699,,,,,monographic,English,text,microfilm|||microform|||microfilm reel,"[6], 18 p.",,,Medicine|||Philosophy|||Early works to 1800,,,,,,12601131,
9917855293406236,"Sidrophel vapulans, or, The quack-astrologer toss'd in a blanket","A rebuke to the authors of a blew-book, call'd The state of physic in London",Sidrophel vapulans|||The quack-astrologer toss'd in a blanket,"Yonge, James, 1647-1721",,London,printed and sold by John Nutt ...,1699,,,,,monographic,English,text,microfilm|||microform|||microfilm reel,"[16], 59 p.",,,"Medicine|||Early works to 1800|||Salmon, William 1644-1713|||Royal College of Physicians of London.|||A rebuke to the authors of a blew-book, call'd The state of physic in London",,England,,,,12793615,
9917891483406236,"epilogue to the five papers lately past betwixt the two physicians Dr. O. and Dr. E: containing some remarks, pleasant and profitable, concerning that debate, and the usefulness of vomiting and purging in fevers, The",,,"Brown, Andrew, M.D",,Edinburgh,Printed by John Reid ...,1699,,,,,monographic,English,text,microfilm|||microform|||microfilm reel,40 p.,,,"Enema|||Controversial literature|||Vomiting|||Medicine|||Early works to 1800|||Oliphant, Charles d. 1719|||Sir Eizat, Edward",,,,,,13117705,
9917934933406236,"letter to Dr. Charles Goodall, physician to the Charter-House: occasioned by his late printed letter entituled A letter from the learned and reverend Dr. Charles Goodall to his honoured friend Dr. Leigh &c. : to which is annexed an answer to a sheet of paper entituled, A reply to Mr. Richard Boulton &c. writ by the aforesaid honoured Charles Leigh by name, M.D. resident in Manchester, not far from the well near Haigh and the well prope Boulton in Lancashire, A",,,"Boulton, Richard, b. 1676 or 7",,London,Printed for A. Baldwin,1699,,,,,monographic,English,text,microfilm|||microform|||microfilm reel,"[4], 28 p.",,,Medicine|||Early works to 1800,,,,,,14346461,
