id,title,uniform_title,alternative_title,creator,contributor,publication_place,publisher,publication_date,encoded_date,creation_date,copyright_date,edition,issuance,language,type_of_resource,format,extent,genre,abstract,subject,temporal_coverage,geographic_coverage,target_audience,isbn,lccn,oclccn,url
9917971103406236,"herds-man's mate, or, A guide for herds-men: teaching how to cure all diseases in bulls, oxen, cows and calves, gathered from sundry good authors, and well approved by the authour, in his thirty years practice : also many cures found out by himself, and never yet written, gathered into this portable volume, and sent abroad for the good of the common-wealth ... : being very profitable for all those that either have, or take charge of keeping this laborious, good, and fruitful kind of cattle, The",,The herds-man's mate|||A guide for herds-men,"Harward, Michael.",,Dublin,Printed by Benjamin Tooke ... and are to be sold by Joseph Wilde ...,1673,,,,,monographic,English,text,microfilm|||microform|||microfilm reel,"[8], 122, [5] p.",,,Veterinary medicine|||Early works to 1800|||Domestic animals|||Diseases|||Cattle,,England,,,,17154152,
9917792063406236,"Cista militaris, or, A military chest, furnished either for sea, or land, with convenient medicines, and necesary instruments",Reisekasten. English. 1674,Cista militaris|||A military chest,,"Lower, Richard, 1631-1691",London,Printed by W. Godbid|||and are to be sold by Moses Pitt ...,1674,,,,,monographic,English|||Latin,text,"microfilm|||microform] : amongst which is also a description of Dr. Lower's lancet, for the more safe bleeding / written in Latin, by Gulielmus Fabritius Hildanus ; Englished for publick benefi|||microform|||microfilm reel","[2], 30 p. : ill.",,,Medicine|||Early works to 1800,,,,,,12388820,
9917825493406236,"Queens closet opened: incomparable secrets in physick, chyrurgery, preserving and candying, &c., which were presented unto the Queen by the most experienced persons of the times, many whereof were had in esteem, when she pleased to descend to private recreations, The",,A queens delight|||The pearl of practice|||The compleat cook|||The Queen's cabinet opened,W. M.,,London,"Printed for Nath. Brooke, and are to be sold by Tho. Guy ...",1674,,,,"Corrected and revived, with many new and large additions : together wirh [sic] three exact tables.",monographic,English,text,microfilm|||microform|||microfilm reel,"3 pts. ([10], 190, [8]; [2], 106, [4]; 123, [7] p., 1 leaf of plates) : port.",Early works to 1800,,"Formulas, recipes, etc|||Medicine, Popular|||Cooking, English",,,,,,12618166,
9917827903406236,"Pharmaceutice rationalis, sive, Diatriba de medicamentorum operationibus in humano corpore",,Pharmaceutice rationalis|||Diatriba de medicamentorum operationibus in humano corpore,"Willis, Thomas, 1621-1675",,Oxford,E. Theatro Sheldoniano,1674,,,,,monographic,Latin,text,microfilm|||microform|||microfilm reel,"[32], 330, [10] p. : ill.",,,Medicine|||Early works to 1800,,Great Britain,,,,12627834,
9917692853406236,"Animadversions on the medicinal observations of the Heidelberg, Palatinate, Dorchester practitioner of physick, Mr. Frederick Loss",,,Alius Medicus.,"Loss, Friedrich.",London,Printed for William Willis ...,1674,,,,,monographic,English|||Latin,text,microfilm|||microform|||microfilm reel,"[21], 123, [22] p.",,,"Medicine|||Early works to 1800|||Loss, Friedrich|||Observationum medicinalium libri quatuor",,,,,,11893053,
9917720733406236,"theoretical and chiefly practical treatise of fevors: wherein it's made evident that the modern practice of curing continual fevors is dangerous and very unsuccessful : hereunto are added several important observations and cures of malignant fevors not inserted in the former impression, A",De febribus tractatus theoreticus et practicus praecipue. English,,"Harvey, Gideon, 1640?-1700?",,London,Printed for William Thackeray ...,1674,,,,,monographic,English|||Latin,text,microfilm|||microform|||microfilm reel,"[8], 127 p.",,,Fever|||Early works to 1800|||Medicine,,,,,,12068459,
9917784153406236,"Medicina militaris, or, A body of military medicines experimented",Medicina militaris. English,Medicina militaris|||A body of military medicines experimented,"Minderer, Raymund, 1570?-1621",,London,"Printed by William Godbid, and are to be sold by Moses Pitt ...",1674,,,,,monographic,English|||German,text,microfilm|||microform|||microfilm reel,"[2], 152, [12] p.",,,"Medicine, Military|||Early works to 1800",,,,,,12354090,
9918007373406236,"art of chymistry, The",,,,"Culpeper, Nicholas, 1616-1654",London,Printed for Simon Neale ...,1674,,,,The third edition.,monographic,English|||Latin,text,microfilm|||microform|||microfilm reel,"[16], 133 [i.e. 135] p., 1 leaf of plates : port.",,,"Medicine|||Formulae, receipts and prescriptions|||Early works to 1800|||Pharmacopoeias",,,,,,24523414,
9917841553406236,"Accomplish'd lady's delight in preserving, physick, beautifying, and cookery: containing I. the art of preserving and candying fruits & flowers ..., II. the physical cabinet, or, excellent receipts in physick and chirurgery : together with some rare beautifying waters, to adorn and add loveliness to the face and body : and also some new and excellent secrets and experiments in the art of angling, 3. the compleat cooks guide, or, directions for dressing all sorts of flesh, fowl, and fish, both in the English and French mode, The",,The physical cabinet|||New and excellent experiments and secrets in the art of angling|||The compleat cook's guide,,"Woolley, Hannah, active 1670",London,"Printed for B. Harris, and are to be sold at his shop ...",1675,,,,,monographic,English,text,microfilm|||microform|||microfilm reel,"[4], 382, [10] p., 3 leaves of plates : ill.",Early works to 1800,,"Cooking|||Canning and preserving|||Early works to 1800|||Medicine, Popular|||Beauty, Personal|||Fishing",,,,,,12710291,
9917846693406236,"new idea of the practice of physic written by that famous Franciscus De Le Boe: the first book, of the diseases either constituting, producing, or following the natural functions of man not in health : wherein is containd ... a vindication of the spleen and mother from fits attributed to them : as also a new discovery of intermitting fevers, the yellow jaundice, and other diseases never before discovered, all cleard by anatomical experiments, and chymical demonstrations, as also by their cures : whereto is prefixed a preface written by Dr. Mar. Nedham, A",Praxeos medicae idea nova,,"Sylvius, François de le Boë, 1614-1672","Nedham, Marchamont, 1620-1678",London,Printed for Brabazon Aylmer ...,1675,,,,,monographic,English|||Latin,text,microfilm|||microform|||microfilm reel,"[47], 511, [1] p. : port.",,,Diseases|||Causes and theories of causation|||Early works to 1800|||Medicine,,,,,,12738636,
9917687403406236,"corner-stone laid towards the building of a new colledge (that is to say, a new body of physicians) in London: upon occasion of the vexations and oppressive proceedings acted in the name of the society called the Colledge of Physicians : for the better information of all men, as well as of physicians, chirurgians, and apothecaries, touching the unhappy estate of the art of physick, here in England, it being an apology for the better education of physicians, A",,A corner-stone laid towards the building of a new colledge in London,"Huyberts, Adrian.",,London,Printed for the Author,1675,,,,,monographic,English,text,microfilm|||microform|||microfilm reel,"[2], 38 p.",,,Medicine|||Medical education|||Early works to 1800|||Royal College of Physicians of London.,15th-18th centuries,England,,,,11849358,
9917711393406236,"practice of the most successful physitian Paul Barbette: with the notes and observations of Frederick Deckers, The",Praxis Barbettiana. English,,"Barbette, Paul, -1666?","Dekkers, Frederick, 1644-1720",London,Printed by T.R. for Henry Brome ...,1675,,,,,monographic,English|||Latin,text,microfilm|||microform|||microfilm reel,"[15], 271, [1] p.",,,"Medicine|||Early works to 1800|||Barbette, Paul -1666?",,,,,,12011448,
9917753103406236,"Pharmacopœia Londinensis, or, The London dispensatory: further adorned by the studies and collections of the fellows now living, of the said colledge",Pharmacopoeia Londinensis. English,Pharmacopœia Londinensis|||The London dispensatory,,"Royal College of Physicians of London|||Culpeper, Nicholas, 1616-1654",London,Printed for George Sawbridge ...,1675,,,,,monographic,English|||Latin,text,microfilm|||microform|||microfilm reel,"[24], 305, [39] p.",,,Pharmacopoeias|||Dispensatories|||Medicine|||Early works to 1800,,England,,,,12243899,
9917768663406236,"Choice and experimented receipts in physick and chirurgery: as also cordial and distilled waters and spirits, perfumes, and other curiosities",,Receipts in physick and chirurgery,"Digby, Kenelm, 1603-1665","Hartman, G. (George)",London,"Printed by Andrew Clark, for Henry Brome ...",1675,,,,The second edition corrected & amended.,monographic,English,text,microfilm|||microform|||microfilm reel,"[4], 146, [8] p.",Early works to 1800,,"Formulas, recipes, etc|||Medicine, Popular|||Early works to 1800|||Medicine|||Formulae, receipts, prescriptions",,,,,,12277059,
9917777693406236,"potable balsome of life: being a collection of the choicest preservatives that are extant within the three natural families of minerals, vegetables and animals, reduced into such essences and tinctures by the scientifick art of chymie ... by which the bodies which are in health may be preserved, The",,,"Belon, P. (Peter)",,London,Printed for the author,1675,,,,,monographic,English,text,microfilm|||microform|||microfilm reel,"[4], 20 p.",,,"Medicine, Popular|||Early works to 1800",,,,,,12317902,
9935302343406236,"practice of the most successful physitian Paul Barbette, The",,,"Barbette, Paul, -1666?","Dekkers, Frederick, 1644-1720",London,Printed by T. R. for Henry Brome,1675,,,,,monographic,English,text,print,"[16], 271 p. ; 17 cm.",Early works to 1800,,Medicine|||Practice,,,,,,ocm14326109|||14326109,
9917978403406236,"Spadacrene Dunelmensis, or, A short treatise of an ancient medicinal fountain or vitrioline spaw near the city of Durham: together with the constituent principles, virtues and use thereof",,Spadacrene dunelmensis|||A short treatise of an ancient medicinal fountain or vitrioline spaw near the city of Durham,E. W. (Edward Wilson),,London,Printed by W. Godbid,1675,,,,,monographic,English,text,microfilm|||microform|||microfilm reel,"[30], 88 p.",,,Mineral waters|||Therapeutic use|||Health resorts|||Medicine|||Early works to 1800,,Durham|||England,,,,17882348,
9917982643406236,"Clavis medicinæ, or, A new method of physick: shewing divers rare and special remedies for most diseases, likewise an excellent way to cure the gout, and to dissolve the stone",,Clavis medicinæ|||A new method of physick,"Love, Jeremiah.",,London,Printed by J.R. for W.B.,1675,,,,,monographic,English,text,microfilm|||microform|||microfilm reel,"[4], 59 p.",,,Therapeutics|||Early works to 1800|||Clinical medicine,,England,,,,18211443,
9918005373406236,"Every woman her own midwife, or, A Compleat cabinet opened for child-bearing women: furnished with directions to prevent miscarriages during the time of breeding, and other casualties which usually attend women in child-bed : to which is annexed cures for all sorts of diseases incident to the bodies of men, women and children",Cures for severall diseases|||Preservatives against the plague,Compleat cabinet opened for child-bearing women,,,London,Printed for Simon Neale ...,1675,,,,,monographic,English,text,microfilm|||microform|||microfilm reel,206 p. in various pagings.,,,"Medicine, Popular|||Early works to 1800|||Obstetrics|||Popular works|||Pharmacopoeias",,,,,,23236078,
9917598013406236,"Pharmaceutice rationalis, sive, Diatriba de medicamentorum operationibus in humano corpore",,Diatriba de medicamentorum operationibus in humano corpore,"Willis, Thomas, 1621-1675",,Oxford,E theatro Sheldoniano,1675,,,,Pars secunda.,monographic,Latin,text,microfilm|||microform|||microfilm reel,"[54], 496, [13] p., [7] leaves of plates : ill.",,,Pharmacology|||Early works to 1800|||Medicine,,,,,nuc87826792,07900583,
9917613373406236,Of the imperfection of the chymist's doctrine of qualities,,,"Boyle, Robert, 1627-1691",,London,Printed by E. Flesher for R. Davis,1675,,,,,monographic,English,text,microfilm|||microform|||microfilm reel,"50, [2] p.",,,Medicine|||Early works to 1800|||Chemistry,,,,,,08836941,
9917619103406236,"Medicatrix, or, The woman-physician: vindicating Thomas O'Dowde, a chymical physician and royal licentiate, and chymistry, against the calumnies and abusive reflections of Henry Stubbe",,The woman-physician,"Trye, Mary.",,London,"Printed by T.R. & N.T., and sold by Henry Broome and John Leete",1675,,,,,monographic,English,text,microfilm|||microform|||microfilm reel,"[6], 126, [10] p.",,,"Medicine|||Early works to 1800|||O'Dowde, Thomas|||Stubbe, Henry 1632-1676",,,,,,09149117,
9917838403406236,"character of a true physician, or, A true chymist compared with a goose-quill pedant: with a short view of the frauds and abuses in physick, committed by the confederate prescribing doctoral methodists, with their combinators the apothecaries ... : being a vindication of such physicians as follow not their method but make and administer their own medicines, being the honestest, safest, cheapest, and speediest way of practice, both for physician and patient, A",,A true chymist compared with a goose-quill pedant,"Fletcher, R. (Richard), fl. 1676-1677",,London,Printed for the author,1676,,,,,monographic,English,text,microfilm|||microform|||microfilm reel,"30, [1] p.",,,Physicians|||Quacks and quackery|||History|||Medicine|||Early works to 1800|||Medical ethics,17th century,England,,,,12685861,
9917697603406236,Observations medicæ circa morborum acutorum historiam et curationem,,Methodus curandi febres,"Sydenham, Thomas, 1624-1689",,London,Typis A.C. impensis Gualteri Kettilby ...,1676,,,,,monographic,Latin,text,microfilm|||microform|||microfilm reel,"[54], 425, [53] p.",,,Medicine|||Early works to 1800|||Fever,,,,,,11920943,
9917714923406236,"Kitchin-physick, or, Advice to the poor: by way of dialogue betwixt Philanthropos, physician, Eugenius, apthecary [sic], Lazarus, patient : with rules and directions, how to prevent sickness, and cure diseases by diet",,Kitchin physick|||Kitchin-physick|||Advice to the poor|||Miscelanea medica|||A short discourse on stoving and bathing|||A supplement to Kitchin-physick,"Cock, Thomas.",,London,Printed for Dorman Newman ...,1676,,,,,monographic,English,text,microfilm|||microform|||microfilm reel,"[6], 87, [9], 52, [4] p., [1] leaf of plates : ill.",,,"Medicine|||Early works to 1800|||Hygiene|||Thomson, George active 17th century|||Galen",,,,,,12033367,
9917749633406236,"Thesaurus chirurgiæ: the chirurgical & anatomical vvorks of Paul Barbette, M.D. practitioner at Amsterdam : composed according to the doctrine of the circulation of the blood, and other new inventions of the moderns : together with a treatise of the plague, illustrated with observations",Chirurgie nae de hedendaeghse practijck beschreven. English,,"Barbette, Paul, -1666?",,London,"Printed, and are to be sold by Moses Pitt ...",1676,,,,The third edition /,monographic,English|||Dutch,text,microfilm|||microform|||microfilm reel,3 v. : ill.,,,Medicine|||Early works to 1800|||Surgery|||Surgical instruments and apparatus,,,,,,12224795,
9917754283406236,"Practical physick, or, Five distinct treatises of the most predominant diseases of these times: the first of the scurvy, the second of the dropsie, the third of feavers and agues of all sort, the fourth of the French pox, and the fifth of the gout, wherein the nature, causes, symptomes, various methods of cure, and waies of preventing every of the said diseases, are severally handled, and plainly discovered to the meanest capacity",De lue venera. English|||De arthritide tractatus. English|||De febribus. English|||De scorbuto. English|||De symptomatibus quae hepati accidunt. English,Practical physick|||Five distinct treatises of the most predominant diseases,"Sennert, Daniel, 1572-1637","Care, Henry, 1646-1688",London,Printed for William Whitwood ...,1676,,,,,monographic,English|||Latin,text,microfilm|||microform|||microfilm reel,"[16], 149, [15], 279 p.",,,Medicine|||Early works to 1800,,,,,,12246716,
9914440343406236,"Recveil de receptes: où est expliqvée la manière de guerir à peu de frais toute sorte de maux tant internes, qu'externes inueterez, & qui ont passé jusqu'à present pour incurables",,,"Fouquet, Marie de Maupeou, vicomtesse de Vaux, 1590-1681",,Lyon,J. Certe,1676,,,,,monographic,French,text,microfilm|||Microform|||microfilm reel,2 parts in 1.,,,"Therapeutics|||Early works to 1800|||Medicine|||Formulae, receipts, prescriptions",,,,,,15635229,
9914716243406236,"Danielis Sennerti Opera omnia, in sex tomos divisa",,,"Sennert, Daniel, 1572-1637",,Lyon,J.A. Huguetan,1676,,,,"Editio novissima caeteris omnibus tum correctior, tum auctior tomo vno ...",monographic,Latin,text,print,6 v. : front (v.1) ; 36 cm.,,,Medicine|||Early works to 1800|||Natural history|||Pre-Linnean works|||Chemistry,,,,,,31147015,
9935354793406236,"Admiranda rerum admirabilium encomia: sive, Diserta & amoena Pallas disserens seria sub ludicra specie.  Hoc est, dissertationum ludicrarum, nec non amoenitatum scriptores varii",,,,,Nijmegen,Typis Reineri Smetii,1676,,,,,monographic,Latin,text,print,660 p. : plates. ; 14 cm.,Early works to 1800,,"Medicine|||Cardano, Girolamo 1501-1576|||Gouthière, Jacques 1568-1638|||Insulanus, Wilhelm -1561|||Pirckheimer, Willibald 1470-1530",,,,,,ocm14295571,
9917970023406236,"Starkey revived, or, Collections out of nature's explication: and Helmont's vindication : being a short examination of the state of physick as now practiced",,Starkey revived|||Collections out of nature's explication,"Fletcher, R. (Richard), fl. 1676-1677",,London,Printed for the author,1676,,,,,monographic,English,text,microfilm|||microform|||microfilm reel,"[4], 28 p.",,,Medicine|||Early works to 1800,,,,,,17061130,
9917990383406236,"Mellificium chirurgiæ, or, The marrow of chirurgery much enlarged: to which is now added Anatomy, illustrated with twelve brass cuts, and also The marrow of physick, both in the newest way",,Mellificium chirurgiæ|||The marrow of chirurgery much enalarged|||Anatomy|||The marrow of physick,"Cooke, James, 1614-1694",,London,"Printed by J.D. for Benji. Shirley, and are to be sold at his shop ...",1676,,,,,monographic,English,text,microfilm|||microform|||microfilm reel,"[37], 872 [i.e. 864] p. : ill., port.",,,Surgery|||Early works to 1800|||Medicine|||Hippocrates|||Aphorisms,1500|||1800,,,,,18508646,
9917652233406236,"Sudorificum regale, or, The royal sudoforick",,Sudorificum regale|||The royal sudoforick,"Barker, Richard, Sir",,London,Printed by J.D. for Sir Richard Barker,1676,,,,,monographic,English,text,microfilm|||microform|||microfilm reel,"[47], 32 p.",,,Medicine|||Early works to 1800,,,,,,10805066,
9917656873406236,Tractatus de arthritide: accesserunt ejusdem consilia aliquot medicinalia,,,"Mayerne, Théodore Turquet de, Sir, 1573-1655","Bonet, Théophile, 1620-1689",London,Impensis Mosis Pitt ...,1676,,,,,monographic,Latin,text,microfilm|||microform|||microfilm reel,"[4], 188, [13] p.",,,Gout|||Early works to 1800|||Medicine,,,,,,11164567,
9917672893406236,"new disease, or, A rational account of the great colds and couhgs [sic] now raging amongst us: shewing the true causes of the said distempers, and approved remedies for their speedy cure : together with the author's solemn invitation to all that shall escape those maladies, to come and dine with him Christmas next, The",,The new disease|||A rational account of the great colds and couhgs [sic] now raging amongst us,J. L.,,London,Printed for W.T.,1676,,,,,monographic,English,text,microfilm|||microform|||microfilm reel,7 p.,,,Medicine|||Early works to 1800,,,,,,11724785,
9917677013406236,"divine physician, prescribing rules for the prevention, and cure of most diseases, as well of the body, as the soul: demonstrating by natural reason, and also divine and humane testimony, that, as vicious and irregular actions and affections prove often occasions of most bodily diseases, and shortness of life, so the contrary do conduce to the preservation of health, and prolongation of life : in two parts, The",,,"Harris, John, 1667?-1719",,London,"Printed for George Rose ..., and by Nath. Brook, and Will. Whitwood ...",1676,,,,,monographic,English,text,microfilm|||microform|||microfilm reel,"[16], 201, [6] p.",,,Medicine|||Early works to 1800,,,,,,11766955,
9917791573406236,"New experiments upon vipers: with exquisite remedies that may be drawn from them as well for the cure of their bitings, as for that of other maladies : also a tetter [sic] of Francisco Redi, concerning some objections made upon his observations about vipers written to Monsieur Bourdelot and Mr. Alex. Morus : together with the sequel of New experiments upon vipers, in a reply to a letter written by Sign. Fredi",Nouvelles expériences sur la vipère. English,,"Charas, Moyse, 1619-1698",,London,Printed for Mark Pardoe ...,1677,,,,,monographic,English|||French ,text,microfilm|||microform|||microfilm reel,"[16], 112 p., 3 folded leaves of plates.",,,"Snakes|||Medicine, Popular|||Early works to 1800",,,,,,12387154,
9917867993406236,Pharmacopoeia Collegii Regalis Londini,Pharmacopoeia Londinensis,,,Royal College of Physicians of London,London,"Impensis Tho. Newcomb, Tho. Basset, Joh. Wright & Ric. Chiswel",1677,,,,,monographic,Latin,text,microfilm|||microform|||microfilm reel,"[18], 208, [6] p.",,,Pharmacopoeias|||Dispensatories|||Medicine|||Early works to 1800,,England,,,,12904699,
9917776833406236,"Medicinal councels, or advices",,,"Mayerne, Théodore Turquet de, Sir, 1573-1655","Bonet, Théophile, 1620-1689|||Sherley, Thomas, 1638-1678",London,Printed for N. Ponder ...,1677,,,,,monographic,English|||French|||Latin,text,microfilm|||microform|||microfilm reel,"[16], 136, [7] p.",,,Medicine|||Early works to 1800,,,,,,12308678,
9917782153406236,Pharmacopoeia Collegii regalis Londini,Pharmacopoeia Londinensis,,,Royal College of Physicians of London,London,"Typis Tho. Newcomb|||Prostant venales apud Joh. Martyn, Joh. Starkey, Tho. Basset, Joh. Wright, Ric. Chiswel, & Rob. Boulter",1677,,,,,monographic,Latin,text,microfilm|||microform|||microfilm reel,"[16], 208, [6] p., [3] p. of plates : ill.",,,Pharmacopoeias|||Dispensatories|||Medicine|||Early works to 1800,,England,,,,12340588,
9918834243406236,Regneri de Graaf Opera Omnia,,,"Graaf, Reinier de, 1641-1673",,Lyon,Ex officina Hackiana,1677,,,,,monographic,Latin,text,microform|||microopaque,"16, 717 p., [67] leaves of plates : ill., port. ; 18 cm.",,,Medicine|||Early works to 1800|||Generative organs|||Pancreas|||Secretions,,,,,,02044554,
9917606113406236,"Diatribæ duæ medico-philosophicæ: quarum prior agit de fermentatione, sive, de motu intestino, particularum in quovis corpore : altera de febribus, sive, de motu earundem in sanguine animalium : his accessit dissertatio epistolica de urinis",,,"Willis, Thomas, 1621-1675",,London,"Typis T.R., Impensis J. Martyn",1677,,,,Editio quarta.,monographic,Latin,text,microfilm|||microform,"[33], 376 p.",,,Medicine|||Early works to 1800|||Biochemistry|||Physiology,,,,,,08250759,
9917658613406236,"Culpeper's last legacy left and bequeathed to his dearest wife for the publick good: being the choycest and most profitable of those secrets which while he lived were lockt up in his breast and resolved never to be publish'd till after his death ... with an addition of two hundred choyce receipts lately found, never publish'd before in any of his other works, and a compleat table",Opus physicum,,"Culpeper, Nicholas, 1616-1654",,London,Printed for Obadiah Blagrave ...,1677,,,,The fifth impression,monographic,English,text,microfilm|||microform|||microfilm reel,"[8], 276, [13], 60 p.",,,Medicine|||Early works to 1800|||Therapeutics|||Anatomy,,,,,,11192436,
9917660723406236,"Anatomia sambuci, or, The anatomy of the elder: cutting out of it plain, approved, and specific remedies for most and chiefest maladies : confirmed and cleared by reason, experience, and history",,Anatomia sambuci|||The anatomy of the elder,"Blochwitz, Martin.",,London,Printed for H. Brome ... and Tho. Sawbridge ...,1677,,,,,monographic,English|||Latin,text,microfilm|||microform|||microfilm reel,"[19], 230 p.",,,"Medicine|||Early works to 1800|||Botany, Medical",,,,,,11217730,
9917807873406236,"works of that famous chirurgeon Ambrose Parey, The",Works. English. 1678,Angeiologia,"Paré, Ambroise, 1510?-1590","Johnson, Thomas, -1644|||Spiegel, Adriaan van de, 1578-1625",London,"Printed by Mary Clark, and are to be sold by John Clark ...",1678,,,,,monographic,English|||Latin,text,microfilm|||microform|||microfilm reel,"[20], 713, [4], 44, [15] p., 2 leaves of plates : ill.",,,Medicine|||Early works to 1800|||Surgery|||Anatomy,,,,,,12498405,
