id,title,uniform_title,alternative_title,enumeration_chronology,associated_name,publication_place,publisher,publication_date,start_date,end_date,edition,issuance,frequency,language,type_of_resource,format,extent,genre,abstract,subject,temporal_coverage,geographic_coverage,target_audience,preceded_by,succeeded_by,copyright_status,copyright_holder,copyright_note,record_id,issn,lccn,oclccn,depositor,url,collection_id
ctc00032,The Women,,,,,Oakland,,,,,,,,,still image,8x10 Gelatin Silver Print,,photograph,Members of the Pitt Players are shown rehearsing The Women. The play was considered the 25th anniversary production of the Pitt Players and featured an all female cast. Buell Whitehill was the director of the production. Whitehill was director of many Pitt Players theatre productions during the 1930s and 1940s. The play was presented by the Pitt Players and the University of Pittsburgh at the Stephen Foster Memorial March 11th through the 14th during the 1941-1942 season. The Pitt Players were a student theatre club at the University of Pittsburgh that was active from 1916 to 1960.,"Whitehill, Buell B., Jr.|||University of Pittsburgh. Pitt Players.|||College theater|||Pennsylvania|||Pittsburgh.|||Luce, Clare Boothe, 1903-1987. Women.|||Oakland (Pittsburgh, Pa.).",,Oakland,,,,unknown,,,,,,,University of Pittsburgh,,collection.7|||collection.109|||collection.8|||collection.10
ctc00033,Hedda Gabler,,,,,Oakland,,,,,,,,,still image,7x9.5 Gelatin Silver Print,,photograph,Eleanor Zuzinas (as Thea Elvsted) and Martha Shissler (as Hedda Tesman) appeared together in Hedda Gabler. The play was presented by the Pitt Players and the University of Pittsburgh at the Stephen Foster Memorial during the 1944-1945 season. The Pitt Players were a student theatre club at the University of Pittsburgh that was active from 1916 to 1960.,"Whitehill, Buell B., Jr.|||Zuzinas, Eleanor.|||Shissler, Martha.|||University of Pittsburgh. Pitt Players.|||College theater|||Pennsylvania|||Pittsburgh.|||Ibsen, Henrik, 1828-1906. Hedda Gabler.|||Oakland (Pittsburgh, Pa.).",,Oakland,,,,unknown,,,,,,,University of Pittsburgh,,collection.7|||collection.109|||collection.8|||collection.10
ctc00034,The Flies,,,,,Oakland,,,,,,,,,still image,8x10 Gelatin Silver Print,,photograph,"The Pitt Players rehearsing a scene from The Flies, which was directed by Harvey J. Pope. The play was banned by the Roman Catholic Church; nevertheless, all performances were sold out. Pope was director of many Pitt Players theatre productions during the 1940s and 1950s. The play was presented by the Pitt Players and the University of Pittsburgh at the Stephen Foster Memorial December 9th through the 11th during the 1948-1949 season. The Pitt Players were a student theatre club at the University of Pittsburgh that was active from 1916 to 1960.","Pope, Harvey J.|||University of Pittsburgh. Pitt Players.|||College theater|||Pennsylvania|||Pittsburgh.|||Sartre, Jean-Paul, 1905-1980. Mouches. English.|||Oakland (Pittsburgh, Pa.).",,Oakland,,,,unknown,,,,,,,University of Pittsburgh,,collection.7|||collection.109|||collection.8|||collection.10
ctc00035,Candida,,,,,Oakland,,,,,,,,,still image,8x10 Gelatin Silver Print,,photograph,"The Pitt Players cast of Candida, directed by Harvey J. Pope, posing on the set during a rehearsal. Pope was director of many Pitt Players theatre productions during the 1940s and 1950s. The play was presented by the Pitt Players and the University of Pittsburgh at the Stephen Foster Memorial March 10th through the 12th during the 1948-1949 season. The Pitt Players were a student theatre club at the University of Pittsburgh that was active from 1916 to 1960.","Pope, Harvey J.|||University of Pittsburgh. Pitt Players.|||College theater|||Pennsylvania|||Pittsburgh.|||Shaw, Bernard, 1856-1950. Candida.|||Oakland (Pittsburgh, Pa.).",,Oakland,,,,unknown,,,,,,,University of Pittsburgh,,collection.7|||collection.109|||collection.8|||collection.10
ctc00036,Candida,,,,,Oakland,,,,,,,,,still image,8x10 Gelatin Silver Print,,photograph,"The Pitt Players cast of Candida, directed by Harvey J. Pope, posing on the set during a rehearsal. Pope was director of many Pitt Players theatre productions during the 1940s and 1950s. The play was presented by the Pitt Players and the University of Pittsburgh at the Stephen Foster Memorial March 10th through the 12th during the 1948-1949 season. The Pitt Players were a student theatre club at the University of Pittsburgh that was active from 1916 to 1960.","Pope, Harvey J.|||University of Pittsburgh. Pitt Players.|||College theater|||Pennsylvania|||Pittsburgh.|||Shaw, Bernard, 1856-1950. Candida.|||Oakland (Pittsburgh, Pa.).",,Oakland,,,,unknown,,,,,,,University of Pittsburgh,,collection.7|||collection.109|||collection.8|||collection.10
ctc00037,The Dark of the Moon,,,,,Oakland,,,,,,,,,still image,8x10 Gelatin Silver Print,,photograph,"Beti Bucci (as Dark Witch), Melvin Silver (as John), and Doris Kolasheski (as Fair Witch) rehearsing a scene from The Dark of the Moon, which was directed by Harvey J. Pope. Pope was director of many Pitt Players theatre productions during the 1940s and 1950s. The play was presented by the Pitt Players and the University of Pittsburgh at the Stephen Foster Memorial May 12th through 14th during the 1948-1949 season. The Pitt Players were a student theatre club at the University of Pittsburgh that was active from 1916 to 1960.","Pope, Harvey J.|||Bucci, Beti.|||Silver, Melvin.|||Kolasheski, Doris.|||University of Pittsburgh. Pitt Players.|||College theater|||Pennsylvania|||Pittsburgh.|||Richardson, Howard. Dark of the Moon.|||Oakland (Pittsburgh, Pa.).",,Oakland,,,,unknown,,,,,,,University of Pittsburgh,,collection.7|||collection.109|||collection.8|||collection.10
ctc00038,The Dark of the Moon,,,,,Oakland,,,,,,,,,still image,8x10 Gelatin Silver Print,,photograph,"Melvin Silver (as John), Gloria Brodie (as Barbara Allen), and Arthur Ragen (as Marvin Hudgens) rehearsing a scene from The Dark of the Moon, which was directed by Harvey J. Pope. Pope was director of many Pitt Players theatre productions during the 1940s and 1950s. The play was presented by the Pitt Players and the University of Pittsburgh at the Stephen Foster Memorial May 12th through 14th during the 1948-1949 season. The Pitt Players were a student theatre club at the University of Pittsburgh that was active from 1916 to 1960.","Pope, Harvey J.|||Brodie, Gloria.|||Silver, Melvin.|||Ragen, Arthur.|||University of Pittsburgh. Pitt Players.|||College theater|||Pennsylvania|||Pittsburgh.|||Richardson, Howard. Dark of the Moon.|||Oakland (Pittsburgh, Pa.).",,Oakland,,,,unknown,,,,,,,University of Pittsburgh,,collection.7|||collection.109|||collection.8|||collection.10
ctc00039,Brigadoon,,,,,Oakland,,,,,,,,,still image,8x10 Gelatin Silver Print,,photograph,"Group photograph of cast of the Pitt Players’ production of Brigadoon, which was directed by Michael McHale, assembled on stage. The play was presented by the Pitt Players and the University of Pittsburgh at the Stephen Foster Memorial April 24th through 27th during the 1956-1957 season. The Pitt Players were a student theatre club at the University of Pittsburgh that was active from 1916 to 1960.","McHale, Michael.|||University of Pittsburgh. Pitt Players.|||College theater|||Pennsylvania|||Pittsburgh.|||Loewe, Frederick, 1901-1988. Brigadoon.|||Oakland (Pittsburgh, Pa.).",,Oakland,,,,unknown,,,,,,,University of Pittsburgh,,collection.7|||collection.109|||collection.8|||collection.10
ctc00040,Brigadoon,,,,,Oakland,,,,,,,,,still image,8x10 Gelatin Silver Print,,photograph,"Group photograph of female cast members in the Pitt Players’ production of Brigadoon, which was directed by Michael McHale. The play was presented by the Pitt Players and the University of Pittsburgh at the Stephen Foster Memorial April 24th through 27th during the 1956-1957 season. The Pitt Players were a student theatre club at the University of Pittsburgh that was active from 1916 to 1960.","McHale, Michael.|||University of Pittsburgh. Pitt Players.|||College theater|||Pennsylvania|||Pittsburgh.|||Loewe, Frederick, 1901-1988. Brigadoon.|||Oakland (Pittsburgh, Pa.).",,Oakland,,,,unknown,,,,,,,University of Pittsburgh,,collection.7|||collection.109|||collection.8|||collection.10
ctc00041,Brigadoon,,,,Bob Hawxhurst (creator),Oakland,,,,,,,,,still image,8x10 Gelatin Silver Print,,photograph,"Myrna Granowitz (as Meg Brockie) and Allen Majesky (as Angus McGuffie) performing in a non-dress rehearsal of Brigadoon, which was directed by Michael McHale. The play was presented by the Pitt Players and the University of Pittsburgh at the Stephen Foster Memorial May 12th through 14th during the 1956-1957 season. The Pitt Players were a student theatre club at the University of Pittsburgh that was active from 1916 to 1960.","McHale, Michael.|||Granowitz, Myrna.|||Majesky, Allen.|||University of Pittsburgh. Pitt Players.|||College theater|||Pennsylvania|||Pittsburgh.|||Loewe, Frederick, 1901-1988. Brigadoon.|||Oakland (Pittsburgh, Pa.).",,Oakland,,,,unknown,,,,,,,University of Pittsburgh,,collection.7|||collection.109|||collection.8|||collection.10
ctc00042,Brigadoon,,,,,Oakland,,,,,,,,,still image,8x10 Gelatin Silver Print,,photograph,"Myrna Granowitz (as Meg Brockie) and Allen Majesky (as Angus McGuffie) performing in a dress rehearsal of Brigadoon, which was directed by Michael McHale. The play was presented by the Pitt Players and the University of Pittsburgh at the Stephen Foster Memorial May 12th through 14th during the 1956-1957 season. The Pitt Players were a student theatre club at the University of Pittsburgh that was active from 1916 to 1960.","McHale, Michael.|||Granowitz, Myrna.|||Majesky, Allen.|||University of Pittsburgh. Pitt Players.|||College theater|||Pennsylvania|||Pittsburgh.|||Loewe, Frederick, 1901-1988. Brigadoon.|||Oakland (Pittsburgh, Pa.).",,Oakland,,,,unknown,,,,,,,University of Pittsburgh,,collection.7|||collection.109|||collection.8|||collection.10
ctc00043,Skin of our Teeth,,,,,Oakland,,,,,,,,,still image,8x10 Gelatin Silver Print,,photograph,"Norman Bloom (as Henry) and Ethel Schacter (as Sabrina) posing for a photograph in promotion of the play The Skin of Our Teeth, which was directed by Michael McHale. The play was presented by the Pitt Players and the University of Pittsburgh at the Stephen Foster Memorial December 5th through the 7th during the 1957-1958 season. The Pitt Players were a student theatre club at the University of Pittsburgh that was active from 1916 to 1960.","McHale, Michael.|||Bloom, Norman.|||Schacter, Ethel.|||University of Pittsburgh. Pitt Players.|||College theater|||Pennsylvania|||Pittsburgh.|||Wilder, Thornton, 1897-1975. Skin of our teeth.|||Oakland (Pittsburgh, Pa.).",,Oakland,,,,unknown,,,,,,,University of Pittsburgh,,collection.7|||collection.109|||collection.8|||collection.10
ctc00044,Guys and Dolls,,,,Thomas G. Gosztonyi (creator),Oakland,,,,,,,,,still image,8x10 Gelatin Silver Print,,photograph,"Cast members of the Pitt Players’ production of Guys and Dolls, directed by Michael McHale, pose for a photograph during dress rehearsal. The play was presented by the Pitt Players and the University of Pittsburgh at the Stephen Foster Memorial March 17th through 21st during the 1958-1959 season. The Pitt Players were a student theatre club at the University of Pittsburgh that was active from 1916 to 1960.","McHale, Michael.|||University of Pittsburgh. Pitt Players.|||College theater|||Pennsylvania|||Pittsburgh.|||Runyon, Damon, 1880-1946. Guys and dolls.|||Oakland (Pittsburgh, Pa.).",,Oakland,,,,unknown,,,,,,,University of Pittsburgh,,collection.7|||collection.109|||collection.8|||collection.10
ctc00045,Maxixe Girl,,,,,Oakland,,,,,,,,,still image,8x14 Gelatin Silver Print,,photograph,"The cast of the Cap and Gown Club’s production of The Maxixe Girl, which was directed by Professor Herbert Reynolds Kniffin, poses for a photograph on the set. The play was presented by the Cap and Gown Club and the University of Pittsburgh at the Schenley Theater February 26th and 27th, 1915. The Cap and Gown Club was an all-male student theatre group at the University of Pittsburgh that was active from 1908 to 1947.","Kniffin, Herbert Reynolds.|||Cap and Gown Club (Pittsburgh. Pa.).|||University of Pittsburgh.|||College theater|||Pennsylvania|||Pittsburgh.|||Reis, G. Norman. Maxixe girl.|||Oakland (Pittsburgh, Pa.).",,Oakland,,,,unknown,,,,,,,University of Pittsburgh,,collection.7|||collection.109|||collection.8|||collection.10
ctc00046,"Pickets, Please!",,,,Rembrandt Studios (creator),Downtown,,,,,,,,,still image,10x14 Gelatin Silver Print,,photograph,"George Zargon poses for a photograph in costume for the Cap and Gown Club’s production of Pickets, Please!, which was directed by Gene Kelly (listed as Eugene C. Kelly). The play was presented by the Cap and Gown Club and the University of Pittsburgh at the Nixon Theatre the week of April 4th, 1938. The Cap and Gown Club was an all-male student theatre group at the University of Pittsburgh that was active from 1908 to 1947.","Kelly, Gene, 1912-1996.|||Zargon, George.|||Cap and Gown Club (Pittsburgh. Pa.).|||University of Pittsburgh.|||College theater|||Pennsylvania|||Pittsburgh.|||Saffron, Robert. Pickets, please!|||Spanos, Nicholas C. Pickets, please!|||Downtown (Pittsburgh, Pa.).",,Downtown,,,,unknown,,,,,,,University of Pittsburgh,,collection.7|||collection.109|||collection.8|||collection.10
ctc00047,"Pickets, Please!",,,,,Downtown,,,,,,,,,still image,10x13 Gelatin Silver Print,,photograph,"The marquee of the Nixon Theatre during the Cap and Gown Club’s production of Pickets, Please!, which was directed by Gene Kelly (listed as Eugene C. Kelly). The play was presented by the Cap and Gown Club and the University of Pittsburgh at the Nixon Theatre the week of April 4th, 1938. The Cap and Gown Club was an all-male student theatre group at the University of Pittsburgh that was active from 1908 to 1947.","Kelly, Gene, 1912-1996.|||Cap and Gown Club (Pittsburgh. Pa.).|||University of Pittsburgh.|||College theater|||Pennsylvania|||Pittsburgh.|||Saffron, Robert. Pickets, please!|||Spanos, Nicholas C. Pickets, please!|||Downtown (Pittsburgh, Pa.).",,Downtown,,,,unknown,,,,,,,University of Pittsburgh,,collection.7|||collection.109|||collection.8|||collection.10
ctc00048,"Pickets, Please!",,,,Rembrandt Studios (creator),Downtown,,,,,,,,,still image,8x10 Gelatin Silver Print,,photograph,"George Zargon and Al Barr pose for a photograph in costume for the Cap and Gown Club’s production of Pickets, Please!, which was directed by Gene Kelly (listed as Eugene C. Kelly). The play was presented by the Cap and Gown Club and the University of Pittsburgh at the Nixon Theatre the week of April 4th, 1938. The Cap and Gown Club was an all-male student theatre group at the University of Pittsburgh that was active from 1908 to 1947.","Kelly, Gene, 1912-1996.|||Zargon, George.|||Barr, Albert J.|||Cap and Gown Club (Pittsburgh. Pa.).|||University of Pittsburgh.|||College theater|||Pennsylvania|||Pittsburgh.|||Saffron, Robert. Pickets, please!|||Spanos, Nicholas C. Pickets, please!|||Downtown (Pittsburgh, Pa.).",,Downtown,,,,unknown,,,,,,,University of Pittsburgh,,collection.7|||collection.109|||collection.8|||collection.10
ctc00049,"Pickets, Please!",,,,Rembrandt Studios (creator),Downtown,,,,,,,,,still image,8x10 Gelatin Silver Print,,photograph,"Members of the Cap and Gown Club pose for a photograph in costume for their production of Pickets, Please!, which was directed by Gene Kelly (listed as Eugene C. Kelly). The play was presented by the Cap and Gown Club and the University of Pittsburgh at the Nixon Theatre the week of April 4th, 1938. The Cap and Gown Club was an all-male student theatre group at the University of Pittsburgh that was active from 1908 to 1947.","Kelly, Gene, 1912-1996.|||Cap and Gown Club (Pittsburgh. Pa.).|||University of Pittsburgh.|||College theater|||Pennsylvania|||Pittsburgh.|||Saffron, Robert. Pickets, please!|||Spanos, Nicholas C. Pickets, please!|||Downtown (Pittsburgh, Pa.).",,Downtown,,,,unknown,,,,,,,University of Pittsburgh,,collection.7|||collection.109|||collection.8|||collection.10
ctc00050,"Pickets, Please!",,,,Rembrandt Studios (creator),Downtown,,,,,,,,,still image,10x14 Gelatin Silver Print,,photograph,"Bill Hoeveler poses for a photograph in costume for the Cap and Gown Club’s production of Pickets, Please!, which was directed by Gene Kelly (listed as Eugene C. Kelly). In the show, Hoeveler played the role of Minnie McTish, ""an enterprising chorus girl."" The play was presented by the Cap and Gown Club and the University of Pittsburgh at the Nixon Theatre the week of April 4th, 1938. The Cap and Gown Club was an all-male student theatre group at the University of Pittsburgh that was active from 1908 to 1947.","Kelly, Gene, 1912-1996.|||Hoeveler, William.|||Cap and Gown Club (Pittsburgh. Pa.).|||University of Pittsburgh.|||College theater|||Pennsylvania|||Pittsburgh.|||Saffron, Robert. Pickets, please!|||Spanos, Nicholas C. Pickets, please!|||Downtown (Pittsburgh, Pa.).",,Downtown,,,,unknown,,,,,,,University of Pittsburgh,,collection.7|||collection.109|||collection.8|||collection.10
ctc00051,"Pickets, Please!",,,,Rembrandt Studios (creator),Downtown,,,,,,,,,still image,10x14 Gelatin Silver Print,,photograph,"Bill Hoeveler poses for a photograph in costume for the Cap and Gown Club’s production of Pickets, Please!, which was directed by Gene Kelly (listed as Eugene C. Kelly). In the show Hoeveler played the role of Minnie McTish, ""an enterprising chorus girl."" The play was presented by the Cap and Gown Club and the University of Pittsburgh at the Nixon Theatre the week of April 4th, 1938. The Cap and Gown Club was an all-male student theatre group at the University of Pittsburgh that was active from 1908 to 1947.","Kelly, Gene, 1912-1996.|||Hoeveler, William.|||Cap and Gown Club (Pittsburgh. Pa.).|||University of Pittsburgh.|||College theater|||Pennsylvania|||Pittsburgh.|||Saffron, Robert. Pickets, please!|||Spanos, Nicholas C. Pickets, please!|||Downtown (Pittsburgh, Pa.).",,Downtown,,,,unknown,,,,,,,University of Pittsburgh,,collection.7|||collection.109|||collection.8|||collection.10
ctc00052,At Your Service,,,,Rembrandt Studios (creator),Downtown,,,,,,,,,still image,11x14 Gelatin Silver Print,,photograph,"Members of the Cap and Gown Club pose for a photograph in costume for their production of At Your Service, which was directed by Martin B. Fallon. The play was presented by the Cap and Gown Club and the University of Pittsburgh at the Nixon Theatre the week of May 1st, 1939. The Cap and Gown Club was an all-male student theatre group at the University of Pittsburgh that was active from 1908 to 1947.","Fallon, Martin B.|||Cap and Gown Club (Pittsburgh. Pa.).|||University of Pittsburgh.|||College theater|||Pennsylvania|||Pittsburgh.|||Reis, G. Norman. At your service.|||Downtown (Pittsburgh, Pa.).",,Downtown,,,,unknown,,,,,,,University of Pittsburgh,,collection.7|||collection.109|||collection.8|||collection.10
ctc00053,At Your Service,,,,Rembrandt Studios (creator),Downtown,,,,,,,,,still image,11x14 Gelatin Silver Print,,photograph,"Doug Smith, Bill Murray and Bill Hoeveler (from l to r) pose for a photograph in costume for the Cap and Gown Club’s production of At Your Service, which was directed by Martin B. Fallon. The play was presented by the Cap and Gown Club and the University of Pittsburgh at the Nixon Theatre the week of May 1st-8th, 1939. The Cap and Gown Club was an all-male student theatre group at the University of Pittsburgh that was active from 1908 to 1947.","Fallon, Martin B.|||Smith, Douglas.|||Murray, William.|||Hoeveler, William.|||Cap and Gown Club (Pittsburgh. Pa.).|||University of Pittsburgh.|||College theater|||Pennsylvania|||Pittsburgh.|||Reis, G. Norman. At your service.|||Downtown (Pittsburgh, Pa.).",,Downtown,,,,unknown,,,,,,,University of Pittsburgh,,collection.7|||collection.109|||collection.8|||collection.10
ctc00054,At Your Service,,,,Rembrandt Studios (creator),Downtown,,,,,,,,,still image,11x14 Gelatin Silver Print,,photograph,"Bill Hoeveler poses for a photograph in costume for the Cap and Gown Club’s production of At Your Service, which was directed by Martin B. Fallon. In the show, Hoeveler played the role of Flo Marshall. The play was presented by the Cap and Gown Club and the University of Pittsburgh at the Nixon Theatre the week of May 1st-8th, 1939. The Cap and Gown Club was an all-male student theatre group at the University of Pittsburgh that was active from 1908 to 1947.","Fallon, Martin B.|||Hoeveler, William.|||Cap and Gown Club (Pittsburgh. Pa.).|||University of Pittsburgh.|||College theater|||Pennsylvania|||Pittsburgh.|||Reis, G. Norman. At your service.|||Downtown (Pittsburgh, Pa.).",,Downtown,,,,unknown,,,,,,,University of Pittsburgh,,collection.7|||collection.109|||collection.8|||collection.10
ctc00055,At Your Service,,,,Rembrandt Studios (creator),Downtown,,,,,,,,,still image,11x14 Gelatin Silver Print,,photograph,"J. Karl Stark poses for a photograph in costume for the Cap and Gown Club’s production of At Your Service, which was directed by Martin B. Fallon. In the show, Stark played the role of Joe Slick. Martin B. Fallon was the director of the production. The play was presented by the Cap and Gown Club and the University of Pittsburgh at the Nixon Theatre the week of May 1st-8th, 1939. The Cap and Gown Club was an all-male student theatre group at the University of Pittsburgh that was active from 1908 to 1947.","Fallon, Martin B.|||Stark, J. Karl.|||Cap and Gown Club (Pittsburgh. Pa.).|||University of Pittsburgh.|||College theater|||Pennsylvania|||Pittsburgh.|||Reis, G. Norman. At your service.|||Downtown (Pittsburgh, Pa.).",,Downtown,,,,unknown,,,,,,,University of Pittsburgh,,collection.7|||collection.109|||collection.8|||collection.10
ctc00056,At Your Service,,,,Rembrandt Studios (creator),Downtown,,,,,,,,,still image,11x14 Gelatin Silver Print,,photograph,"George Hartman and Milton Hoffman (from l to r) pose for a photograph in costume for the Cap and Gown Club’s production of At Your Service, which was directed by Martin B. Fallon. Martin B. Fallon was the director of the production. The play was presented by the Cap and Gown Club and the University of Pittsburgh at the Nixon Theatre the week of May 1st-8th, 1939. The Cap and Gown Club was an all-male student theatre group at the University of Pittsburgh that was active from 1908 to 1947.","Fallon, Martin B.|||Hartman, George.|||Hoffman, Milton.|||Cap and Gown Club (Pittsburgh. Pa.).|||University of Pittsburgh.|||College theater|||Pennsylvania|||Pittsburgh.|||Reis, G. Norman. At your service.|||Downtown (Pittsburgh, Pa.).",,Downtown,,,,unknown,,,,,,,University of Pittsburgh,,collection.7|||collection.109|||collection.8|||collection.10
ctc00057,At Your Service,,,,,Downtown,,,,,,,,,still image,5x8 Gelatin Silver Print,,photograph,"Sam Hamilton getting measured for his costume in preparation for the Cap and Gown Club's production of At Your Service, which was directed by Martin B. Fallon. The play was presented by the Cap and Gown Club and the University of Pittsburgh at the Nixon Theatre the week of May 1st-8th, 1939. The Cap and Gown Club was an all-male student theatre group at the University of Pittsburgh that was active from 1908 to 1947.","Fallon, Martin B.|||Hamilton, Sam.|||Cap and Gown Club (Pittsburgh. Pa.).|||University of Pittsburgh.|||College theater|||Pennsylvania|||Pittsburgh.|||Reis, G. Norman. At your service.|||Downtown (Pittsburgh, Pa.).",,Downtown,,,,unknown,,,,,,,University of Pittsburgh,,collection.7|||collection.109|||collection.8|||collection.10
ctc00058,Snap Your Fingers,,,,,Downtown,,,,,,,,,still image,10x13.5 Gelatin Silver Print,,photograph,"Howard Jones poses for a photograph in costume for the Cap and Gown Club’s production of Snap Your Fingers, which was directed by James W. Lindsay. The play was presented by the Cap and Gown Club and the University of Pittsburgh at the Nixon Theatre the week of April 29th, 1940. The Cap and Gown Club was an all-male student theatre group at the University of Pittsburgh that was active from 1908 to 1947.","Lindsay, James W.|||Jones, Howard.|||Cap and Gown Club (Pittsburgh. Pa.).|||University of Pittsburgh.|||College theater|||Pennsylvania|||Pittsburgh.|||Miller, Frank S. Snap your fingers.|||Downtown (Pittsburgh, Pa.).",,Downtown,,,,unknown,,,,,,,University of Pittsburgh,,collection.7|||collection.109|||collection.8|||collection.10
ctc00059,Snap Your Fingers,,,,,Downtown,,,,,,,,,still image,10x13.5 Gelatin Silver Print,,photograph,"Part of the men's chorus and Edwin Trembath pose for a photograph in costume for the Cap and Gown Club’s production of Snap Your Fingers, which was directed by James W. Lindsay. Ed Trembath played the part of Mary Wanna. The play was presented by the Cap and Gown Club and the University of Pittsburgh at the Nixon Theatre the week of April 29th, 1940. The Cap and Gown Club was an all-male student theatre group at the University of Pittsburgh that was active from 1908 to 1947.","Lindsay, James W.|||Trembath, Edwin.|||Cap and Gown Club (Pittsburgh. Pa.).|||University of Pittsburgh.|||College theater|||Pennsylvania|||Pittsburgh.|||Miller, Frank S. Snap your fingers.|||Downtown (Pittsburgh, Pa.).",,Downtown,,,,unknown,,,,,,,University of Pittsburgh,,collection.7|||collection.109|||collection.8|||collection.10
